video_id,conjugate,event1_clip,event2_clip,caption,distractor_caption,sim_positive,sim_negative,correct
ZXHLY,before,ZXHLY_0.0_20.0.mp4,ZXHLY_21.3_26.1.mp4,holding a cup/glass/bottle of something before opening a door,opening a door before holding a cup/glass/bottle of something,0.40731164813041687,0.3271031379699707,True
ZXHLY,after,ZXHLY_0.0_20.0.mp4,ZXHLY_21.3_26.1.mp4,opening a door after holding a cup/glass/bottle of something,holding a cup/glass/bottle of something after opening a door,0.411124050617218,0.41960811614990234,False
YSABV,before,YSABV_0.0_8.6.mp4,YSABV_9.2_18.0.mp4,holding some clothes before turning off a light,turning off a light before holding some clothes,0.5667266845703125,0.4065047800540924,True
YSABV,after,YSABV_0.0_8.6.mp4,YSABV_9.2_18.0.mp4,turning off a light after holding some clothes,holding some clothes after turning off a light,0.38546818494796753,0.5159744024276733,False
E6DLK,before,E6DLK_0.0_6.9.mp4,E6DLK_9.3_27.1.mp4,someone is going from standing to sitting before watching/looking outside of a window,watching/looking outside of a window before someone is going from standing to sitting,0.4892861545085907,0.4856570363044739,True
E6DLK,after,E6DLK_0.0_6.9.mp4,E6DLK_9.3_27.1.mp4,watching/looking outside of a window after someone is going from standing to sitting,someone is going from standing to sitting after watching/looking outside of a window,0.493025541305542,0.5106171369552612,False
DRGKV,before,DRGKV_3.9_14.3.mp4,DRGKV_21.0_29.0.mp4,someone is undressing before taking a picture of something,taking a picture of something before someone is undressing,0.5669198036193848,0.4403211176395416,True
DRGKV,after,DRGKV_3.9_14.3.mp4,DRGKV_21.0_29.0.mp4,taking a picture of something after someone is undressing,someone is undressing after taking a picture of something,0.43911853432655334,0.5025298595428467,False
D1VWG,before,D1VWG_0.5_5.2.mp4,D1VWG_14.3_19.6.mp4,walking through a doorway before taking something from a box,taking something from a box before walking through a doorway,0.5014333724975586,0.4635232090950012,True
D1VWG,after,D1VWG_0.5_5.2.mp4,D1VWG_14.3_19.6.mp4,taking something from a box after walking through a doorway,walking through a doorway after taking something from a box,0.4383796155452728,0.4554568827152252,False
T8DK4,before,T8DK4_0.0_16.2.mp4,T8DK4_16.3_23.3.mp4,smiling in a mirror before fixing their hair,fixing their hair before smiling in a mirror,0.5170820355415344,0.4666622281074524,True
T8DK4,after,T8DK4_0.0_16.2.mp4,T8DK4_16.3_23.3.mp4,fixing their hair after smiling in a mirror,smiling in a mirror after fixing their hair,0.41981562972068787,0.4333534836769104,False
MVX03,before,MVX03_0.0_19.4.mp4,MVX03_20.4_25.2.mp4,fixing a door before someone is going from standing to sitting,someone is going from standing to sitting before fixing a door,0.436069518327713,0.4011886715888977,True
MVX03,after,MVX03_0.0_19.4.mp4,MVX03_20.4_25.2.mp4,someone is going from standing to sitting after fixing a door,fixing a door after someone is going from standing to sitting,0.40524232387542725,0.4572303295135498,False
75MO8,before,75MO8_0.0_8.9.mp4,75MO8_11.3_25.7.mp4,someone is running somewhere before drinking from a cup/glass/bottle,drinking from a cup/glass/bottle before someone is running somewhere,0.39202266931533813,0.4243711531162262,False
75MO8,after,75MO8_0.0_8.9.mp4,75MO8_11.3_25.7.mp4,drinking from a cup/glass/bottle after someone is running somewhere,someone is running somewhere after drinking from a cup/glass/bottle,0.4234118163585663,0.34491509199142456,True
OOCOF,before,OOCOF_6.2_11.7.mp4,OOCOF_20.8_26.0.mp4,opening a refrigerator before someone is standing up from somewhere,someone is standing up from somewhere before opening a refrigerator,0.36300212144851685,0.4001239538192749,False
OOCOF,after,OOCOF_6.2_11.7.mp4,OOCOF_20.8_26.0.mp4,someone is standing up from somewhere after opening a refrigerator,opening a refrigerator after someone is standing up from somewhere,0.42529019713401794,0.3334655165672302,True
THW67,before,THW67_0.0_11.0.mp4,THW67_11.2_16.4.mp4,taking off some shoes before taking food from somewhere,taking food from somewhere before taking off some shoes,0.510093629360199,0.4604513943195343,True
THW67,after,THW67_0.0_11.0.mp4,THW67_11.2_16.4.mp4,taking food from somewhere after taking off some shoes,taking off some shoes after taking food from somewhere,0.4600061774253845,0.4843061566352844,False
9MOH2,before,9MOH2_0.0_9.2.mp4,9MOH2_16.0_29.5.mp4,walking through a doorway before holding some medicine,holding some medicine before walking through a doorway,0.4505320191383362,0.4144311845302582,True
9MOH2,after,9MOH2_0.0_9.2.mp4,9MOH2_16.0_29.5.mp4,holding some medicine after walking through a doorway,walking through a doorway after holding some medicine,0.413334459066391,0.46584999561309814,False
2LTCY,before,2LTCY_6.5_11.5.mp4,2LTCY_12.7_18.8.mp4,holding a towel/s before taking a picture of something,taking a picture of something before holding a towel/s,0.49348628520965576,0.35589128732681274,True
2LTCY,after,2LTCY_6.5_11.5.mp4,2LTCY_12.7_18.8.mp4,taking a picture of something after holding a towel/s,holding a towel/s after taking a picture of something,0.3740140199661255,0.4998174011707306,False
3P38N,before,3P38N_0.4_7.8.mp4,3P38N_13.9_18.4.mp4,opening a book before someone is laughing,someone is laughing before opening a book,0.40121185779571533,0.3328341543674469,True
3P38N,after,3P38N_0.4_7.8.mp4,3P38N_13.9_18.4.mp4,someone is laughing after opening a book,opening a book after someone is laughing,0.3323076069355011,0.36114993691444397,False
ZWPS3,before,ZWPS3_5.3_11.7.mp4,ZWPS3_11.9_16.3.mp4,walking through a doorway before holding a cup/glass/bottle of something,holding a cup/glass/bottle of something before walking through a doorway,0.478827565908432,0.5198920965194702,False
ZWPS3,after,ZWPS3_5.3_11.7.mp4,ZWPS3_11.9_16.3.mp4,holding a cup/glass/bottle of something after walking through a doorway,walking through a doorway after holding a cup/glass/bottle of something,0.5129953622817993,0.5048518776893616,True
OQ9W3,before,OQ9W3_0.0_4.9.mp4,OQ9W3_7.4_15.9.mp4,drinking from a cup/glass/bottle before tidying a shelf or something on a shelf,tidying a shelf or something on a shelf before drinking from a cup/glass/bottle,0.43865275382995605,0.47754549980163574,False
OQ9W3,after,OQ9W3_0.0_4.9.mp4,OQ9W3_7.4_15.9.mp4,tidying a shelf or something on a shelf after drinking from a cup/glass/bottle,drinking from a cup/glass/bottle after tidying a shelf or something on a shelf,0.5140243768692017,0.5228930711746216,False
47Y1V,before,47Y1V_1.7_15.6.mp4,47Y1V_15.8_21.7.mp4,holding a picture before putting a dish/es somewhere,putting a dish/es somewhere before holding a picture,0.4920736253261566,0.44478726387023926,True
47Y1V,after,47Y1V_1.7_15.6.mp4,47Y1V_15.8_21.7.mp4,putting a dish/es somewhere after holding a picture,holding a picture after putting a dish/es somewhere,0.44690731167793274,0.4600487947463989,False
Q3Z4V,before,Q3Z4V_0.0_16.3.mp4,Q3Z4V_16.5_20.8.mp4,someone is undressing before holding a cup/glass/bottle of something,holding a cup/glass/bottle of something before someone is undressing,0.5706695318222046,0.4800555408000946,True
Q3Z4V,after,Q3Z4V_0.0_16.3.mp4,Q3Z4V_16.5_20.8.mp4,holding a cup/glass/bottle of something after someone is undressing,someone is undressing after holding a cup/glass/bottle of something,0.5034972429275513,0.551726222038269,False
0BH84,before,0BH84_7.9_14.3.mp4,0BH84_16.2_26.0.mp4,walking through a doorway before taking off some shoes,taking off some shoes before walking through a doorway,0.49586939811706543,0.44300776720046997,True
0BH84,after,0BH84_7.9_14.3.mp4,0BH84_16.2_26.0.mp4,taking off some shoes after walking through a doorway,walking through a doorway after taking off some shoes,0.44514477252960205,0.4627445340156555,False
GXIWH,before,GXIWH_0.0_13.2.mp4,GXIWH_14.5_31.8.mp4,someone is smiling before pouring something into a cup/glass/bottle,pouring something into a cup/glass/bottle before someone is smiling,0.4822598993778229,0.5139327645301819,False
GXIWH,after,GXIWH_0.0_13.2.mp4,GXIWH_14.5_31.8.mp4,pouring something into a cup/glass/bottle after someone is smiling,someone is smiling after pouring something into a cup/glass/bottle,0.5047311782836914,0.4830177426338196,True
1THHL,before,1THHL_0.0_5.1.mp4,1THHL_14.0_27.8.mp4,opening a closet/cabinet before someone is smiling,someone is smiling before opening a closet/cabinet,0.4428037106990814,0.41181686520576477,True
1THHL,after,1THHL_0.0_5.1.mp4,1THHL_14.0_27.8.mp4,someone is smiling after opening a closet/cabinet,opening a closet/cabinet after someone is smiling,0.42895475029945374,0.4443410038948059,False
Y2EID,before,Y2EID_3.4_10.7.mp4,Y2EID_14.0_19.8.mp4,grasping onto a doorknob before someone is sneezing,someone is sneezing before grasping onto a doorknob,0.4671339690685272,0.5368106365203857,False
Y2EID,after,Y2EID_3.4_10.7.mp4,Y2EID_14.0_19.8.mp4,someone is sneezing after grasping onto a doorknob,grasping onto a doorknob after someone is sneezing,0.4914920926094055,0.4403262138366699,True
LLE9B,before,LLE9B_0.0_5.1.mp4,LLE9B_5.4_12.8.mp4,taking food from somewhere before putting some food somewhere,putting some food somewhere before taking food from somewhere,0.44817107915878296,0.44158005714416504,True
LLE9B,after,LLE9B_0.0_5.1.mp4,LLE9B_5.4_12.8.mp4,putting some food somewhere after taking food from somewhere,taking food from somewhere after putting some food somewhere,0.5256933569908142,0.44828101992607117,True
W9BWJ,before,W9BWJ_4.7_13.7.mp4,W9BWJ_15.5_21.6.mp4,drinking from a cup/glass/bottle before putting a cup/glass/bottle somewhere,putting a cup/glass/bottle somewhere before drinking from a cup/glass/bottle,0.41909679770469666,0.4860062897205353,False
W9BWJ,after,W9BWJ_4.7_13.7.mp4,W9BWJ_15.5_21.6.mp4,putting a cup/glass/bottle somewhere after drinking from a cup/glass/bottle,drinking from a cup/glass/bottle after putting a cup/glass/bottle somewhere,0.49135714769363403,0.4179396629333496,True
O441U,before,O441U_0.0_4.6.mp4,O441U_11.3_18.1.mp4,grasping onto a doorknob before closing a closet/cabinet,closing a closet/cabinet before grasping onto a doorknob,0.5252199172973633,0.4705319404602051,True
O441U,after,O441U_0.0_4.6.mp4,O441U_11.3_18.1.mp4,closing a closet/cabinet after grasping onto a doorknob,grasping onto a doorknob after closing a closet/cabinet,0.48855966329574585,0.499820739030838,False
WVG97,before,WVG97_0.0_13.9.mp4,WVG97_18.2_30.0.mp4,holding some clothes before putting on shoe/shoes,putting on shoe/shoes before holding some clothes,0.6102577447891235,0.4769347906112671,True
WVG97,after,WVG97_0.0_13.9.mp4,WVG97_18.2_30.0.mp4,putting on shoe/shoes after holding some clothes,holding some clothes after putting on shoe/shoes,0.4851683974266052,0.5113044381141663,False
5HSKK,before,5HSKK_0.0_5.9.mp4,5HSKK_14.8_20.2.mp4,walking through a doorway before throwing something on the floor,throwing something on the floor before walking through a doorway,0.4211564064025879,0.4432275891304016,False
5HSKK,after,5HSKK_0.0_5.9.mp4,5HSKK_14.8_20.2.mp4,throwing something on the floor after walking through a doorway,walking through a doorway after throwing something on the floor,0.4321553409099579,0.43267589807510376,False
TAQ25,before,TAQ25_0.4_6.2.mp4,TAQ25_11.6_17.7.mp4,someone is going from standing to sitting before closing a laptop,closing a laptop before someone is going from standing to sitting,0.490643173456192,0.3953247368335724,True
TAQ25,after,TAQ25_0.4_6.2.mp4,TAQ25_11.6_17.7.mp4,closing a laptop after someone is going from standing to sitting,someone is going from standing to sitting after closing a laptop,0.3899235725402832,0.4692974090576172,False
MS3E8,before,MS3E8_0.0_7.0.mp4,MS3E8_8.3_13.6.mp4,holding a box before taking something from a box,taking something from a box before holding a box,0.5166403651237488,0.3123290538787842,True
MS3E8,after,MS3E8_0.0_7.0.mp4,MS3E8_8.3_13.6.mp4,taking something from a box after holding a box,holding a box after taking something from a box,0.3744199872016907,0.4749560058116913,False
V7KBN,before,V7KBN_1.5_6.5.mp4,V7KBN_10.3_21.6.mp4,taking a cup/glass/bottle from somewhere before pouring something into a cup/glass/bottle,pouring something into a cup/glass/bottle before taking a cup/glass/bottle from somewhere,0.4941617250442505,0.402385950088501,True
V7KBN,after,V7KBN_1.5_6.5.mp4,V7KBN_10.3_21.6.mp4,pouring something into a cup/glass/bottle after taking a cup/glass/bottle from somewhere,taking a cup/glass/bottle from somewhere after pouring something into a cup/glass/bottle,0.4628165066242218,0.4627699851989746,True
8NGDR,before,8NGDR_0.0_19.9.mp4,8NGDR_21.3_26.3.mp4,lying on a sofa/couch before someone is standing up from somewhere,someone is standing up from somewhere before lying on a sofa/couch,0.5041104555130005,0.5285870432853699,False
8NGDR,after,8NGDR_0.0_19.9.mp4,8NGDR_21.3_26.3.mp4,someone is standing up from somewhere after lying on a sofa/couch,lying on a sofa/couch after someone is standing up from somewhere,0.5044622421264648,0.49389412999153137,True
1YBKW,before,1YBKW_0.0_9.5.mp4,1YBKW_10.3_22.0.mp4,smiling in a mirror before turning on a light,turning on a light before smiling in a mirror,0.5231309533119202,0.4457504153251648,True
1YBKW,after,1YBKW_0.0_9.5.mp4,1YBKW_10.3_22.0.mp4,turning on a light after smiling in a mirror,smiling in a mirror after turning on a light,0.43061867356300354,0.4763804078102112,False
UETQS,before,UETQS_0.0_12.6.mp4,UETQS_14.3_23.7.mp4,sitting at a table before putting a dish/es somewhere,putting a dish/es somewhere before sitting at a table,0.5160168409347534,0.5407153367996216,False
UETQS,after,UETQS_0.0_12.6.mp4,UETQS_14.3_23.7.mp4,putting a dish/es somewhere after sitting at a table,sitting at a table after putting a dish/es somewhere,0.5763295292854309,0.5152484178543091,True
XLQ6X,before,XLQ6X_7.2_13.1.mp4,XLQ6X_15.7_21.1.mp4,holding a blanket before walking through a doorway,walking through a doorway before holding a blanket,0.4695455729961395,0.432760089635849,True
XLQ6X,after,XLQ6X_7.2_13.1.mp4,XLQ6X_15.7_21.1.mp4,walking through a doorway after holding a blanket,holding a blanket after walking through a doorway,0.46907180547714233,0.47644665837287903,False
L5G6N,before,L5G6N_0.1_9.1.mp4,L5G6N_21.5_29.4.mp4,closing a closet/cabinet before someone is standing up from somewhere,someone is standing up from somewhere before closing a closet/cabinet,0.3905147612094879,0.4423271417617798,False
L5G6N,after,L5G6N_0.1_9.1.mp4,L5G6N_21.5_29.4.mp4,someone is standing up from somewhere after closing a closet/cabinet,closing a closet/cabinet after someone is standing up from somewhere,0.46703195571899414,0.34850963950157166,True
A0CJL,before,A0CJL_0.8_6.4.mp4,A0CJL_15.9_21.9.mp4,someone is going from standing to sitting before closing a laptop,closing a laptop before someone is going from standing to sitting,0.5147242546081543,0.4213103950023651,True
A0CJL,after,A0CJL_0.8_6.4.mp4,A0CJL_15.9_21.9.mp4,closing a laptop after someone is going from standing to sitting,someone is going from standing to sitting after closing a laptop,0.41894957423210144,0.4966910481452942,False
7POUA,before,7POUA_0.0_19.7.mp4,7POUA_21.6_31.0.mp4,holding a book before fixing their hair,fixing their hair before holding a book,0.5632809996604919,0.44361379742622375,True
7POUA,after,7POUA_0.0_19.7.mp4,7POUA_21.6_31.0.mp4,fixing their hair after holding a book,holding a book after fixing their hair,0.3913414478302002,0.5100886225700378,False
8XXZZ,before,8XXZZ_0.0_9.5.mp4,8XXZZ_13.7_20.9.mp4,someone is running somewhere before taking a phone/camera from somewhere,taking a phone/camera from somewhere before someone is running somewhere,0.40521007776260376,0.47468137741088867,False
8XXZZ,after,8XXZZ_0.0_9.5.mp4,8XXZZ_13.7_20.9.mp4,taking a phone/camera from somewhere after someone is running somewhere,someone is running somewhere after taking a phone/camera from somewhere,0.4508323669433594,0.42136871814727783,True
00X3U,before,00X3U_0.0_4.9.mp4,00X3U_9.7_15.4.mp4,walking through a doorway before taking a blanket from somewhere,taking a blanket from somewhere before walking through a doorway,0.41687995195388794,0.44723671674728394,False
00X3U,after,00X3U_0.0_4.9.mp4,00X3U_9.7_15.4.mp4,taking a blanket from somewhere after walking through a doorway,walking through a doorway after taking a blanket from somewhere,0.4568856954574585,0.38237321376800537,True
0PU21,before,0PU21_0.6_14.5.mp4,0PU21_16.7_20.9.mp4,drinking from a cup/glass/bottle before holding a picture,holding a picture before drinking from a cup/glass/bottle,0.46425461769104004,0.510138750076294,False
0PU21,after,0PU21_0.6_14.5.mp4,0PU21_16.7_20.9.mp4,holding a picture after drinking from a cup/glass/bottle,drinking from a cup/glass/bottle after holding a picture,0.48905763030052185,0.539786696434021,False
MUZMD,before,MUZMD_0.1_14.1.mp4,MUZMD_18.2_35.3.mp4,holding some medicine before holding a blanket,holding a blanket before holding some medicine,0.37505996227264404,0.3857848346233368,False
MUZMD,after,MUZMD_0.1_14.1.mp4,MUZMD_18.2_35.3.mp4,holding a blanket after holding some medicine,holding some medicine after holding a blanket,0.4037894010543823,0.3714648485183716,True
VLMII,before,VLMII_0.0_6.6.mp4,VLMII_8.4_18.1.mp4,watching a laptop or something on a laptop before putting clothes somewhere,putting clothes somewhere before watching a laptop or something on a laptop,0.4993010461330414,0.5313771367073059,False
VLMII,after,VLMII_0.0_6.6.mp4,VLMII_8.4_18.1.mp4,putting clothes somewhere after watching a laptop or something on a laptop,watching a laptop or something on a laptop after putting clothes somewhere,0.5470242500305176,0.5183935761451721,True
XEJ35,before,XEJ35_0.0_7.0.mp4,XEJ35_10.7_17.1.mp4,holding a towel/s before smiling at a book,smiling at a book before holding a towel/s,0.4645234942436218,0.42191633582115173,True
XEJ35,after,XEJ35_0.0_7.0.mp4,XEJ35_10.7_17.1.mp4,smiling at a book after holding a towel/s,holding a towel/s after smiling at a book,0.4365825951099396,0.4938788115978241,False
PQH3Q,before,PQH3Q_0.0_18.6.mp4,PQH3Q_21.1_29.0.mp4,sitting in a bed before watching something/someone/themselves in a mirror,watching something/someone/themselves in a mirror before sitting in a bed,0.5850282907485962,0.6467628479003906,False
PQH3Q,after,PQH3Q_0.0_18.6.mp4,PQH3Q_21.1_29.0.mp4,watching something/someone/themselves in a mirror after sitting in a bed,sitting in a bed after watching something/someone/themselves in a mirror,0.568575382232666,0.5507601499557495,True
0C5IQ,before,0C5IQ_0.0_5.4.mp4,0C5IQ_8.3_14.6.mp4,taking a towel/s from somewhere before putting a towel/s somewhere,putting a towel/s somewhere before taking a towel/s from somewhere,0.42793262004852295,0.5145086050033569,False
0C5IQ,after,0C5IQ_0.0_5.4.mp4,0C5IQ_8.3_14.6.mp4,putting a towel/s somewhere after taking a towel/s from somewhere,taking a towel/s from somewhere after putting a towel/s somewhere,0.5163947343826294,0.42473307251930237,True
AXFJP,before,AXFJP_0.0_4.2.mp4,AXFJP_8.9_13.8.mp4,walking through a doorway before holding some clothes,holding some clothes before walking through a doorway,0.39608538150787354,0.49258849024772644,False
AXFJP,after,AXFJP_0.0_4.2.mp4,AXFJP_8.9_13.8.mp4,holding some clothes after walking through a doorway,walking through a doorway after holding some clothes,0.49783432483673096,0.4203665554523468,True
WTU0I,before,WTU0I_0.0_3.5.mp4,WTU0I_4.1_46.5.mp4,taking a book from somewhere before watching/reading/looking at a book,watching/reading/looking at a book before taking a book from somewhere,0.43582525849342346,0.5191890597343445,False
WTU0I,after,WTU0I_0.0_3.5.mp4,WTU0I_4.1_46.5.mp4,watching/reading/looking at a book after taking a book from somewhere,taking a book from somewhere after watching/reading/looking at a book,0.47302213311195374,0.42305055260658264,True
URG8B,before,URG8B_0.0_3.1.mp4,URG8B_12.9_19.3.mp4,someone is going from standing to sitting before taking a cup/glass/bottle from somewhere,taking a cup/glass/bottle from somewhere before someone is going from standing to sitting,0.40713605284690857,0.42982131242752075,False
URG8B,after,URG8B_0.0_3.1.mp4,URG8B_12.9_19.3.mp4,taking a cup/glass/bottle from somewhere after someone is going from standing to sitting,someone is going from standing to sitting after taking a cup/glass/bottle from somewhere,0.4666869044303894,0.429777592420578,True
BJXRT,before,BJXRT_0.0_7.1.mp4,BJXRT_7.7_12.9.mp4,taking a towel/s from somewhere before turning on a light,turning on a light before taking a towel/s from somewhere,0.4393618404865265,0.39505526423454285,True
BJXRT,after,BJXRT_0.0_7.1.mp4,BJXRT_7.7_12.9.mp4,turning on a light after taking a towel/s from somewhere,taking a towel/s from somewhere after turning on a light,0.38059863448143005,0.4235011637210846,False
MTUR3,before,MTUR3_2.9_13.1.mp4,MTUR3_26.8_36.5.mp4,walking through a doorway before snuggling with a blanket,snuggling with a blanket before walking through a doorway,0.5131207704544067,0.5011271238327026,True
MTUR3,after,MTUR3_2.9_13.1.mp4,MTUR3_26.8_36.5.mp4,snuggling with a blanket after walking through a doorway,walking through a doorway after snuggling with a blanket,0.500128984451294,0.4654504060745239,True
VJ2QS,before,VJ2QS_1.6_5.8.mp4,VJ2QS_10.0_21.7.mp4,taking a cup/glass/bottle from somewhere before throwing food somewhere,throwing food somewhere before taking a cup/glass/bottle from somewhere,0.39973926544189453,0.46132081747055054,False
VJ2QS,after,VJ2QS_1.6_5.8.mp4,VJ2QS_10.0_21.7.mp4,throwing food somewhere after taking a cup/glass/bottle from somewhere,taking a cup/glass/bottle from somewhere after throwing food somewhere,0.45815369486808777,0.43690091371536255,True
E8JEJ,before,E8JEJ_0.0_4.7.mp4,E8JEJ_5.3_17.7.mp4,grasping onto a doorknob before fixing a door,fixing a door before grasping onto a doorknob,0.5080918073654175,0.5170180797576904,False
E8JEJ,after,E8JEJ_0.0_4.7.mp4,E8JEJ_5.3_17.7.mp4,fixing a door after grasping onto a doorknob,grasping onto a doorknob after fixing a door,0.48565414547920227,0.49274805188179016,False
QXI52,before,QXI52_0.0_4.7.mp4,QXI52_21.6_27.7.mp4,watching television before someone is standing up from somewhere,someone is standing up from somewhere before watching television,0.45109403133392334,0.4434843957424164,True
QXI52,after,QXI52_0.0_4.7.mp4,QXI52_21.6_27.7.mp4,someone is standing up from somewhere after watching television,watching television after someone is standing up from somewhere,0.44416552782058716,0.4626966714859009,False
3731F,before,3731F_0.0_15.8.mp4,3731F_17.4_23.6.mp4,watching a laptop or something on a laptop before opening a refrigerator,opening a refrigerator before watching a laptop or something on a laptop,0.43694543838500977,0.4092196226119995,True
3731F,after,3731F_0.0_15.8.mp4,3731F_17.4_23.6.mp4,opening a refrigerator after watching a laptop or something on a laptop,watching a laptop or something on a laptop after opening a refrigerator,0.41026708483695984,0.5002828240394592,False
TJPFT,before,TJPFT_0.0_3.8.mp4,TJPFT_15.7_20.6.mp4,someone is going from standing to sitting before putting a dish/es somewhere,putting a dish/es somewhere before someone is going from standing to sitting,0.412916362285614,0.5341525077819824,False
TJPFT,after,TJPFT_0.0_3.8.mp4,TJPFT_15.7_20.6.mp4,putting a dish/es somewhere after someone is going from standing to sitting,someone is going from standing to sitting after putting a dish/es somewhere,0.5132220387458801,0.4444813132286072,True
3VMTS,before,3VMTS_0.0_12.0.mp4,3VMTS_18.1_24.8.mp4,lying on a sofa/couch before putting a blanket somewhere,putting a blanket somewhere before lying on a sofa/couch,0.5044352412223816,0.474554181098938,True
3VMTS,after,3VMTS_0.0_12.0.mp4,3VMTS_18.1_24.8.mp4,putting a blanket somewhere after lying on a sofa/couch,lying on a sofa/couch after putting a blanket somewhere,0.5134993195533752,0.5452883839607239,False
RM1FR,before,RM1FR_3.2_10.7.mp4,RM1FR_14.2_20.1.mp4,opening a closet/cabinet before closing a closet/cabinet,closing a closet/cabinet before opening a closet/cabinet,0.3161090314388275,0.3118830621242523,True
RM1FR,after,RM1FR_3.2_10.7.mp4,RM1FR_14.2_20.1.mp4,closing a closet/cabinet after opening a closet/cabinet,opening a closet/cabinet after closing a closet/cabinet,0.38224440813064575,0.35942843556404114,True
S572F,before,S572F_0.0_10.1.mp4,S572F_13.0_21.0.mp4,holding some clothes before taking a blanket from somewhere,taking a blanket from somewhere before holding some clothes,0.538456380367279,0.41010481119155884,True
S572F,after,S572F_0.0_10.1.mp4,S572F_13.0_21.0.mp4,taking a blanket from somewhere after holding some clothes,holding some clothes after taking a blanket from somewhere,0.43864738941192627,0.5418131351470947,False
NH3LX,before,NH3LX_0.8_28.7.mp4,NH3LX_28.8_36.4.mp4,talking on a phone/camera before drinking from a cup/glass/bottle,drinking from a cup/glass/bottle before talking on a phone/camera,0.42354732751846313,0.49753838777542114,False
NH3LX,after,NH3LX_0.8_28.7.mp4,NH3LX_28.8_36.4.mp4,drinking from a cup/glass/bottle after talking on a phone/camera,talking on a phone/camera after drinking from a cup/glass/bottle,0.5442847609519958,0.46486911177635193,True
Q5Y02,before,Q5Y02_0.0_10.5.mp4,Q5Y02_10.5_18.5.mp4,drinking from a cup/glass/bottle before throwing something on the floor,throwing something on the floor before drinking from a cup/glass/bottle,0.4173125624656677,0.4638134241104126,False
Q5Y02,after,Q5Y02_0.0_10.5.mp4,Q5Y02_10.5_18.5.mp4,throwing something on the floor after drinking from a cup/glass/bottle,drinking from a cup/glass/bottle after throwing something on the floor,0.44846585392951965,0.4326593279838562,True
