video_id,conjugate,event1_clip,event2_clip,caption,distractor_caption,sim_positive,sim_negative,correct
PIJRH,before,PIJRH_0.0_5.5.mp4,PIJRH_6.9_12.7.mp4,walking through a doorway before taking a pillow from somewhere,taking a pillow from somewhere before walking through a doorway,0.44409501552581787,0.4388920068740845,True
PIJRH,after,PIJRH_0.0_5.5.mp4,PIJRH_6.9_12.7.mp4,taking a pillow from somewhere after walking through a doorway,walking through a doorway after taking a pillow from somewhere,0.46897414326667786,0.43969371914863586,True
IET7H,before,IET7H_0.0_3.9.mp4,IET7H_7.5_17.2.mp4,walking through a doorway before opening a closet/cabinet,opening a closet/cabinet before walking through a doorway,0.5375109314918518,0.4804510772228241,True
IET7H,after,IET7H_0.0_3.9.mp4,IET7H_7.5_17.2.mp4,opening a closet/cabinet after walking through a doorway,walking through a doorway after opening a closet/cabinet,0.5242869257926941,0.5404744148254395,False
SAK7K,before,SAK7K_0.0_10.8.mp4,SAK7K_19.2_26.5.mp4,holding a vacuum before taking a cup/glass/bottle from somewhere,taking a cup/glass/bottle from somewhere before holding a vacuum,0.4849420487880707,0.3250617980957031,True
SAK7K,after,SAK7K_0.0_10.8.mp4,SAK7K_19.2_26.5.mp4,taking a cup/glass/bottle from somewhere after holding a vacuum,holding a vacuum after taking a cup/glass/bottle from somewhere,0.3938625454902649,0.46039319038391113,False
7HV9Q,before,7HV9Q_0.0_10.8.mp4,7HV9Q_15.3_22.0.mp4,opening a laptop before someone is smiling,someone is smiling before opening a laptop,0.44112861156463623,0.4397432506084442,True
7HV9Q,after,7HV9Q_0.0_10.8.mp4,7HV9Q_15.3_22.0.mp4,someone is smiling after opening a laptop,opening a laptop after someone is smiling,0.4259856939315796,0.4469500780105591,False
6912B,before,6912B_2.1_13.9.mp4,6912B_14.7_21.2.mp4,tidying up a blanket/s before opening a laptop,opening a laptop before tidying up a blanket/s,0.5836273431777954,0.4109122157096863,True
6912B,after,6912B_2.1_13.9.mp4,6912B_14.7_21.2.mp4,opening a laptop after tidying up a blanket/s,tidying up a blanket/s after opening a laptop,0.41549912095069885,0.5696895122528076,False
WK9HE,before,WK9HE_0.0_7.6.mp4,WK9HE_8.4_15.3.mp4,washing a cup/glass/bottle before tidying up with a broom,tidying up with a broom before washing a cup/glass/bottle,0.5064284205436707,0.5567081570625305,False
WK9HE,after,WK9HE_0.0_7.6.mp4,WK9HE_8.4_15.3.mp4,tidying up with a broom after washing a cup/glass/bottle,washing a cup/glass/bottle after tidying up with a broom,0.563213050365448,0.539031982421875,True
ZFQNZ,before,ZFQNZ_1.5_7.8.mp4,ZFQNZ_8.9_13.8.mp4,opening a refrigerator before closing a refrigerator,closing a refrigerator before opening a refrigerator,0.3037123680114746,0.33478114008903503,False
ZFQNZ,after,ZFQNZ_1.5_7.8.mp4,ZFQNZ_8.9_13.8.mp4,closing a refrigerator after opening a refrigerator,opening a refrigerator after closing a refrigerator,0.30376774072647095,0.32072240114212036,False
T38JM,before,T38JM_1.5_14.3.mp4,T38JM_14.3_23.2.mp4,tidying up with a broom before someone is laughing,someone is laughing before tidying up with a broom,0.5424143671989441,0.3913745582103729,True
T38JM,after,T38JM_1.5_14.3.mp4,T38JM_14.3_23.2.mp4,someone is laughing after tidying up with a broom,tidying up with a broom after someone is laughing,0.47370561957359314,0.5240520238876343,False
1G2QC,before,1G2QC_0.0_17.1.mp4,1G2QC_22.8_28.5.mp4,someone is dressing before putting something on a table,putting something on a table before someone is dressing,0.5649281144142151,0.5123071670532227,True
1G2QC,after,1G2QC_0.0_17.1.mp4,1G2QC_22.8_28.5.mp4,putting something on a table after someone is dressing,someone is dressing after putting something on a table,0.5176324844360352,0.5515768527984619,False
WU8I6,before,WU8I6_2.1_7.7.mp4,WU8I6_15.6_22.2.mp4,holding some medicine before putting something on a table,putting something on a table before holding some medicine,0.38569313287734985,0.3389372229576111,True
WU8I6,after,WU8I6_2.1_7.7.mp4,WU8I6_15.6_22.2.mp4,putting something on a table after holding some medicine,holding some medicine after putting something on a table,0.40227922797203064,0.3830970525741577,True
AQ5M6,before,AQ5M6_0.0_7.7.mp4,AQ5M6_9.8_18.2.mp4,turning off a light before holding a towel/s,holding a towel/s before turning off a light,0.3381403386592865,0.46236664056777954,False
AQ5M6,after,AQ5M6_0.0_7.7.mp4,AQ5M6_9.8_18.2.mp4,holding a towel/s after turning off a light,turning off a light after holding a towel/s,0.4426141381263733,0.32546085119247437,True
I75CL,before,I75CL_0.0_6.9.mp4,I75CL_10.7_17.9.mp4,opening a door before someone is eating something,someone is eating something before opening a door,0.49770957231521606,0.42787888646125793,True
I75CL,after,I75CL_0.0_6.9.mp4,I75CL_10.7_17.9.mp4,someone is eating something after opening a door,opening a door after someone is eating something,0.45660683512687683,0.458301305770874,False
2M9YL,before,2M9YL_2.2_7.4.mp4,2M9YL_9.0_18.9.mp4,taking a dish/es from somewhere before holding a sandwich,holding a sandwich before taking a dish/es from somewhere,0.3872348368167877,0.4281315803527832,False
2M9YL,after,2M9YL_2.2_7.4.mp4,2M9YL_9.0_18.9.mp4,holding a sandwich after taking a dish/es from somewhere,taking a dish/es from somewhere after holding a sandwich,0.41215771436691284,0.4119480550289154,True
NQKZB,before,NQKZB_0.0_12.5.mp4,NQKZB_13.2_31.9.mp4,tidying some clothes before holding a pillow,holding a pillow before tidying some clothes,0.5616587400436401,0.5867732167243958,False
NQKZB,after,NQKZB_0.0_12.5.mp4,NQKZB_13.2_31.9.mp4,holding a pillow after tidying some clothes,tidying some clothes after holding a pillow,0.5909081101417542,0.5432656407356262,True
CWUDQ,before,CWUDQ_0.6_10.1.mp4,CWUDQ_12.0_19.4.mp4,walking through a doorway before someone is undressing,someone is undressing before walking through a doorway,0.48902028799057007,0.5546315312385559,False
CWUDQ,after,CWUDQ_0.6_10.1.mp4,CWUDQ_12.0_19.4.mp4,someone is undressing after walking through a doorway,walking through a doorway after someone is undressing,0.5131438374519348,0.5371083617210388,False
L8HMR,before,L8HMR_0.0_14.0.mp4,L8HMR_18.1_23.6.mp4,holding a blanket before putting something on a shelf,putting something on a shelf before holding a blanket,0.5085559487342834,0.41863778233528137,True
L8HMR,after,L8HMR_0.0_14.0.mp4,L8HMR_18.1_23.6.mp4,putting something on a shelf after holding a blanket,holding a blanket after putting something on a shelf,0.478398859500885,0.472257137298584,True
H1J19,before,H1J19_0.0_17.1.mp4,H1J19_17.8_23.2.mp4,eating a sandwich before putting something on a table,putting something on a table before eating a sandwich,0.3445762097835541,0.44879335165023804,False
H1J19,after,H1J19_0.0_17.1.mp4,H1J19_17.8_23.2.mp4,putting something on a table after eating a sandwich,eating a sandwich after putting something on a table,0.4704757630825043,0.37961331009864807,True
1AA6Z,before,1AA6Z_0.0_7.7.mp4,1AA6Z_8.2_16.3.mp4,someone is undressing before taking food from somewhere,taking food from somewhere before someone is undressing,0.5349375605583191,0.417285680770874,True
1AA6Z,after,1AA6Z_0.0_7.7.mp4,1AA6Z_8.2_16.3.mp4,taking food from somewhere after someone is undressing,someone is undressing after taking food from somewhere,0.4509000778198242,0.4958535134792328,False
GL7ER,before,GL7ER_0.0_2.9.mp4,GL7ER_5.0_16.6.mp4,putting a dish/es somewhere before taking a dish/es from somewhere,taking a dish/es from somewhere before putting a dish/es somewhere,0.5086487531661987,0.4814944863319397,True
GL7ER,after,GL7ER_0.0_2.9.mp4,GL7ER_5.0_16.6.mp4,taking a dish/es from somewhere after putting a dish/es somewhere,putting a dish/es somewhere after taking a dish/es from somewhere,0.4312783479690552,0.5593613386154175,False
5VDT6,before,5VDT6_2.0_9.3.mp4,5VDT6_18.3_23.1.mp4,drinking from a cup/glass/bottle before throwing something on the floor,throwing something on the floor before drinking from a cup/glass/bottle,0.41465768218040466,0.474132776260376,False
5VDT6,after,5VDT6_2.0_9.3.mp4,5VDT6_18.3_23.1.mp4,throwing something on the floor after drinking from a cup/glass/bottle,drinking from a cup/glass/bottle after throwing something on the floor,0.4516621232032776,0.4362841248512268,True
A2XH1,before,A2XH1_0.0_6.9.mp4,A2XH1_12.1_19.8.mp4,taking food from somewhere before someone is going from standing to sitting,someone is going from standing to sitting before taking food from somewhere,0.4669751226902008,0.5133410692214966,False
A2XH1,after,A2XH1_0.0_6.9.mp4,A2XH1_12.1_19.8.mp4,someone is going from standing to sitting after taking food from somewhere,taking food from somewhere after someone is going from standing to sitting,0.5351254940032959,0.49921393394470215,True
VI2TX,before,VI2TX_1.3_5.6.mp4,VI2TX_6.9_12.3.mp4,putting something on a table before holding some food,holding some food before putting something on a table,0.4314720630645752,0.4852261245250702,False
VI2TX,after,VI2TX_1.3_5.6.mp4,VI2TX_6.9_12.3.mp4,holding some food after putting something on a table,putting something on a table after holding some food,0.4478742778301239,0.4522663950920105,False
Z2A7Q,before,Z2A7Q_0.0_9.1.mp4,Z2A7Q_17.2_22.1.mp4,someone is running somewhere before putting a box somewhere,putting a box somewhere before someone is running somewhere,0.3379669189453125,0.3442065119743347,False
Z2A7Q,after,Z2A7Q_0.0_9.1.mp4,Z2A7Q_17.2_22.1.mp4,putting a box somewhere after someone is running somewhere,someone is running somewhere after putting a box somewhere,0.38506194949150085,0.353437215089798,True
OMBR9,before,OMBR9_4.5_13.1.mp4,OMBR9_20.5_64.9.mp4,someone is going from standing to sitting before putting something on a table,putting something on a table before someone is going from standing to sitting,0.4792070984840393,0.5084246397018433,False
OMBR9,after,OMBR9_4.5_13.1.mp4,OMBR9_20.5_64.9.mp4,putting something on a table after someone is going from standing to sitting,someone is going from standing to sitting after putting something on a table,0.48681938648223877,0.494673490524292,False
TX020,before,TX020_0.0_7.0.mp4,TX020_8.0_13.4.mp4,someone is running somewhere before someone is going from standing to sitting,someone is going from standing to sitting before someone is running somewhere,0.2813236713409424,0.29558292031288147,False
TX020,after,TX020_0.0_7.0.mp4,TX020_8.0_13.4.mp4,someone is going from standing to sitting after someone is running somewhere,someone is running somewhere after someone is going from standing to sitting,0.3224363923072815,0.32940593361854553,False
BKEYX,before,BKEYX_4.5_13.6.mp4,BKEYX_23.3_32.1.mp4,putting something on a shelf before drinking from a cup/glass/bottle,drinking from a cup/glass/bottle before putting something on a shelf,0.4164489209651947,0.3859633505344391,True
BKEYX,after,BKEYX_4.5_13.6.mp4,BKEYX_23.3_32.1.mp4,drinking from a cup/glass/bottle after putting something on a shelf,putting something on a shelf after drinking from a cup/glass/bottle,0.3918973207473755,0.42372605204582214,False
JOMFO,before,JOMFO_0.0_6.7.mp4,JOMFO_11.4_19.7.mp4,someone is going from standing to sitting before tidying up a blanket/s,tidying up a blanket/s before someone is going from standing to sitting,0.415465772151947,0.5379341840744019,False
JOMFO,after,JOMFO_0.0_6.7.mp4,JOMFO_11.4_19.7.mp4,tidying up a blanket/s after someone is going from standing to sitting,someone is going from standing to sitting after tidying up a blanket/s,0.5370370149612427,0.46309441328048706,True
2544C,before,2544C_0.0_6.0.mp4,2544C_10.6_15.8.mp4,throwing a towel/s somewhere before putting a towel/s somewhere,putting a towel/s somewhere before throwing a towel/s somewhere,0.5005561709403992,0.5042052268981934,False
2544C,after,2544C_0.0_6.0.mp4,2544C_10.6_15.8.mp4,putting a towel/s somewhere after throwing a towel/s somewhere,throwing a towel/s somewhere after putting a towel/s somewhere,0.5504576563835144,0.5187379121780396,True
NNG97,before,NNG97_0.0_2.6.mp4,NNG97_8.0_28.5.mp4,throwing a book somewhere before holding a book,holding a book before throwing a book somewhere,0.3487900495529175,0.510574460029602,False
NNG97,after,NNG97_0.0_2.6.mp4,NNG97_8.0_28.5.mp4,holding a book after throwing a book somewhere,throwing a book somewhere after holding a book,0.4601265788078308,0.4371340572834015,True
XO97L,before,XO97L_0.2_9.5.mp4,XO97L_15.6_20.7.mp4,taking some clothes from somewhere before watching/looking outside of a window,watching/looking outside of a window before taking some clothes from somewhere,0.48569321632385254,0.5345553159713745,False
XO97L,after,XO97L_0.2_9.5.mp4,XO97L_15.6_20.7.mp4,watching/looking outside of a window after taking some clothes from somewhere,taking some clothes from somewhere after watching/looking outside of a window,0.5159218907356262,0.4907841086387634,True
BP94L,before,BP94L_0.0_12.3.mp4,BP94L_13.0_20.2.mp4,tidying up with a broom before holding a phone/camera,holding a phone/camera before tidying up with a broom,0.5405988693237305,0.5370814204216003,True
BP94L,after,BP94L_0.0_12.3.mp4,BP94L_13.0_20.2.mp4,holding a phone/camera after tidying up with a broom,tidying up with a broom after holding a phone/camera,0.5673279166221619,0.4796673059463501,True
Y0CA0,before,Y0CA0_6.5_12.4.mp4,Y0CA0_15.6_22.3.mp4,closing a closet/cabinet before someone is cooking something,someone is cooking something before closing a closet/cabinet,0.45706769824028015,0.4956226348876953,False
Y0CA0,after,Y0CA0_6.5_12.4.mp4,Y0CA0_15.6_22.3.mp4,someone is cooking something after closing a closet/cabinet,closing a closet/cabinet after someone is cooking something,0.4740728735923767,0.4297100305557251,True
JC9SA,before,JC9SA_0.0_7.0.mp4,JC9SA_8.9_16.5.mp4,closing a refrigerator before closing a door,closing a door before closing a refrigerator,0.4327555000782013,0.3767901062965393,True
JC9SA,after,JC9SA_0.0_7.0.mp4,JC9SA_8.9_16.5.mp4,closing a door after closing a refrigerator,closing a refrigerator after closing a door,0.4457777142524719,0.391517698764801,True
NAZ52,before,NAZ52_0.0_6.1.mp4,NAZ52_11.0_15.9.mp4,opening a box before laughing at a picture,laughing at a picture before opening a box,0.4832723140716553,0.4920075535774231,False
NAZ52,after,NAZ52_0.0_6.1.mp4,NAZ52_11.0_15.9.mp4,laughing at a picture after opening a box,opening a box after laughing at a picture,0.5268988013267517,0.46610215306282043,True
SDXZ8,before,SDXZ8_1.1_28.0.mp4,SDXZ8_33.5_38.8.mp4,taking a dish/es from somewhere before taking a vacuum from somewhere,taking a vacuum from somewhere before taking a dish/es from somewhere,0.39663633704185486,0.39992213249206543,False
SDXZ8,after,SDXZ8_1.1_28.0.mp4,SDXZ8_33.5_38.8.mp4,taking a vacuum from somewhere after taking a dish/es from somewhere,taking a dish/es from somewhere after taking a vacuum from somewhere,0.39892786741256714,0.41038787364959717,False
61WIS,before,61WIS_0.0_5.6.mp4,61WIS_9.6_16.1.mp4,sitting on sofa/couch before putting a pillow somewhere,putting a pillow somewhere before sitting on sofa/couch,0.5681132078170776,0.4830479919910431,True
61WIS,after,61WIS_0.0_5.6.mp4,61WIS_9.6_16.1.mp4,putting a pillow somewhere after sitting on sofa/couch,sitting on sofa/couch after putting a pillow somewhere,0.5180258750915527,0.5907961130142212,False
73NG4,before,73NG4_0.0_5.8.mp4,73NG4_6.0_12.4.mp4,opening a refrigerator before putting some food somewhere,putting some food somewhere before opening a refrigerator,0.42343243956565857,0.4716496467590332,False
73NG4,after,73NG4_0.0_5.8.mp4,73NG4_6.0_12.4.mp4,putting some food somewhere after opening a refrigerator,opening a refrigerator after putting some food somewhere,0.5042439699172974,0.42361271381378174,True
65ULK,before,65ULK_0.0_3.5.mp4,65ULK_7.5_23.7.mp4,walking through a doorway before holding some clothes,holding some clothes before walking through a doorway,0.4512861967086792,0.4988915026187897,False
65ULK,after,65ULK_0.0_3.5.mp4,65ULK_7.5_23.7.mp4,holding some clothes after walking through a doorway,walking through a doorway after holding some clothes,0.4975454807281494,0.46540820598602295,True
N9VOV,before,N9VOV_4.1_9.8.mp4,N9VOV_19.0_24.3.mp4,taking a cup/glass/bottle from somewhere before putting something on a table,putting something on a table before taking a cup/glass/bottle from somewhere,0.40065574645996094,0.4392491579055786,False
N9VOV,after,N9VOV_4.1_9.8.mp4,N9VOV_19.0_24.3.mp4,putting something on a table after taking a cup/glass/bottle from somewhere,taking a cup/glass/bottle from somewhere after putting something on a table,0.4905802607536316,0.44061943888664246,True
2GGH3,before,2GGH3_0.0_9.0.mp4,2GGH3_9.3_21.7.mp4,holding a box before holding some medicine,holding some medicine before holding a box,0.4174458682537079,0.3476465344429016,True
2GGH3,after,2GGH3_0.0_9.0.mp4,2GGH3_9.3_21.7.mp4,holding some medicine after holding a box,holding a box after holding some medicine,0.3988116979598999,0.47800058126449585,False
WB17C,before,WB17C_0.9_7.2.mp4,WB17C_7.5_15.1.mp4,opening a refrigerator before holding a bag,holding a bag before opening a refrigerator,0.4273536503314972,0.5095380544662476,False
WB17C,after,WB17C_0.9_7.2.mp4,WB17C_7.5_15.1.mp4,holding a bag after opening a refrigerator,opening a refrigerator after holding a bag,0.4776900112628937,0.4226560890674591,True
S7OTQ,before,S7OTQ_0.0_5.5.mp4,S7OTQ_13.3_20.7.mp4,someone is going from standing to sitting before closing a book,closing a book before someone is going from standing to sitting,0.536286473274231,0.39674901962280273,True
S7OTQ,after,S7OTQ_0.0_5.5.mp4,S7OTQ_13.3_20.7.mp4,closing a book after someone is going from standing to sitting,someone is going from standing to sitting after closing a book,0.4186784029006958,0.5207874178886414,False
OU3XH,before,OU3XH_0.0_18.7.mp4,OU3XH_19.2_24.4.mp4,playing with a phone/camera before putting some food somewhere,putting some food somewhere before playing with a phone/camera,0.5390697717666626,0.5180375576019287,True
OU3XH,after,OU3XH_0.0_18.7.mp4,OU3XH_19.2_24.4.mp4,putting some food somewhere after playing with a phone/camera,playing with a phone/camera after putting some food somewhere,0.5305563807487488,0.5610983371734619,False
0CX32,before,0CX32_0.0_4.5.mp4,0CX32_5.1_11.0.mp4,someone is running somewhere before holding a broom,holding a broom before someone is running somewhere,0.3226155638694763,0.42219430208206177,False
0CX32,after,0CX32_0.0_4.5.mp4,0CX32_5.1_11.0.mp4,holding a broom after someone is running somewhere,someone is running somewhere after holding a broom,0.455640584230423,0.3613108992576599,True
UZRQD,before,UZRQD_0.8_23.2.mp4,UZRQD_23.3_28.6.mp4,playing with a phone/camera before someone is standing up from somewhere,someone is standing up from somewhere before playing with a phone/camera,0.41146406531333923,0.43366825580596924,False
UZRQD,after,UZRQD_0.8_23.2.mp4,UZRQD_23.3_28.6.mp4,someone is standing up from somewhere after playing with a phone/camera,playing with a phone/camera after someone is standing up from somewhere,0.4459607005119324,0.41391390562057495,True
Z6U1X,before,Z6U1X_0.0_11.4.mp4,Z6U1X_12.2_20.8.mp4,holding a broom before opening a door,opening a door before holding a broom,0.5046517252922058,0.42585673928260803,True
Z6U1X,after,Z6U1X_0.0_11.4.mp4,Z6U1X_12.2_20.8.mp4,opening a door after holding a broom,holding a broom after opening a door,0.44974350929260254,0.46948835253715515,False
GFK4S,before,GFK4S_0.0_12.6.mp4,GFK4S_14.1_20.6.mp4,lying on a sofa/couch before opening a door,opening a door before lying on a sofa/couch,0.4378052055835724,0.2652672827243805,True
GFK4S,after,GFK4S_0.0_12.6.mp4,GFK4S_14.1_20.6.mp4,opening a door after lying on a sofa/couch,lying on a sofa/couch after opening a door,0.37201544642448425,0.4357255697250366,False
Z5AZW,before,Z5AZW_0.0_3.8.mp4,Z5AZW_5.9_10.8.mp4,walking through a doorway before throwing a towel/s somewhere,throwing a towel/s somewhere before walking through a doorway,0.48011988401412964,0.499328076839447,False
Z5AZW,after,Z5AZW_0.0_3.8.mp4,Z5AZW_5.9_10.8.mp4,throwing a towel/s somewhere after walking through a doorway,walking through a doorway after throwing a towel/s somewhere,0.4913589358329773,0.45201218128204346,True
CD11G,before,CD11G_0.0_7.7.mp4,CD11G_9.8_16.2.mp4,someone is cooking something before someone is eating something,someone is eating something before someone is cooking something,0.4573269784450531,0.3514499366283417,True
CD11G,after,CD11G_0.0_7.7.mp4,CD11G_9.8_16.2.mp4,someone is eating something after someone is cooking something,someone is cooking something after someone is eating something,0.4376523196697235,0.43172740936279297,True
2TAT3,before,2TAT3_0.3_6.4.mp4,2TAT3_7.7_16.3.mp4,walking through a doorway before drinking from a cup/glass/bottle,drinking from a cup/glass/bottle before walking through a doorway,0.4687122106552124,0.5538814067840576,False
2TAT3,after,2TAT3_0.3_6.4.mp4,2TAT3_7.7_16.3.mp4,drinking from a cup/glass/bottle after walking through a doorway,walking through a doorway after drinking from a cup/glass/bottle,0.557969868183136,0.49847739934921265,True
UM5II,before,UM5II_0.9_7.7.mp4,UM5II_10.8_17.7.mp4,someone is sneezing before putting some food somewhere,putting some food somewhere before someone is sneezing,0.46599823236465454,0.4254714250564575,True
UM5II,after,UM5II_0.9_7.7.mp4,UM5II_10.8_17.7.mp4,putting some food somewhere after someone is sneezing,someone is sneezing after putting some food somewhere,0.47406870126724243,0.42740780115127563,True
9Q1N7,before,9Q1N7_0.0_11.7.mp4,9Q1N7_12.6_18.9.mp4,sitting on the floor before walking through a doorway,walking through a doorway before sitting on the floor,0.5068759322166443,0.42183682322502136,True
9Q1N7,after,9Q1N7_0.0_11.7.mp4,9Q1N7_12.6_18.9.mp4,walking through a doorway after sitting on the floor,sitting on the floor after walking through a doorway,0.44359931349754333,0.49465686082839966,False
Q5ZIL,before,Q5ZIL_0.0_6.7.mp4,Q5ZIL_8.7_24.6.mp4,someone is sneezing before holding some medicine,holding some medicine before someone is sneezing,0.4118131399154663,0.37896186113357544,True
Q5ZIL,after,Q5ZIL_0.0_6.7.mp4,Q5ZIL_8.7_24.6.mp4,holding some medicine after someone is sneezing,someone is sneezing after holding some medicine,0.3770093321800232,0.3922377824783325,False
EOUCM,before,EOUCM_0.0_8.9.mp4,EOUCM_13.4_19.9.mp4,putting a box somewhere before opening a box,opening a box before putting a box somewhere,0.47407639026641846,0.5160858035087585,False
EOUCM,after,EOUCM_0.0_8.9.mp4,EOUCM_13.4_19.9.mp4,opening a box after putting a box somewhere,putting a box somewhere after opening a box,0.5469142198562622,0.580886960029602,False
QDPR8,before,QDPR8_0.0_10.4.mp4,QDPR8_20.2_25.2.mp4,taking food from somewhere before throwing food somewhere,throwing food somewhere before taking food from somewhere,0.4311075210571289,0.4621620178222656,False
QDPR8,after,QDPR8_0.0_10.4.mp4,QDPR8_20.2_25.2.mp4,throwing food somewhere after taking food from somewhere,taking food from somewhere after throwing food somewhere,0.5011794567108154,0.40992769598960876,True
0J1AQ,before,0J1AQ_0.9_6.5.mp4,0J1AQ_8.9_14.0.mp4,someone is going from standing to sitting before putting shoes somewhere,putting shoes somewhere before someone is going from standing to sitting,0.40378427505493164,0.4758155643939972,False
0J1AQ,after,0J1AQ_0.9_6.5.mp4,0J1AQ_8.9_14.0.mp4,putting shoes somewhere after someone is going from standing to sitting,someone is going from standing to sitting after putting shoes somewhere,0.4814426898956299,0.4059014916419983,True
3B97C,before,3B97C_2.1_8.5.mp4,3B97C_10.6_17.8.mp4,holding a laptop before putting something on a shelf,putting something on a shelf before holding a laptop,0.4123949706554413,0.4064710736274719,True
3B97C,after,3B97C_2.1_8.5.mp4,3B97C_10.6_17.8.mp4,putting something on a shelf after holding a laptop,holding a laptop after putting something on a shelf,0.40700435638427734,0.349994957447052,True
3X52E,before,3X52E_0.0_3.8.mp4,3X52E_14.6_19.8.mp4,holding a blanket before throwing a blanket somewhere,throwing a blanket somewhere before holding a blanket,0.5220953226089478,0.47456151247024536,True
3X52E,after,3X52E_0.0_3.8.mp4,3X52E_14.6_19.8.mp4,throwing a blanket somewhere after holding a blanket,holding a blanket after throwing a blanket somewhere,0.5168848037719727,0.5197700262069702,False
QT6X8,before,QT6X8_4.6_15.2.mp4,QT6X8_26.2_36.1.mp4,throwing clothes somewhere before holding a picture,holding a picture before throwing clothes somewhere,0.5620864033699036,0.5640546083450317,False
QT6X8,after,QT6X8_4.6_15.2.mp4,QT6X8_26.2_36.1.mp4,holding a picture after throwing clothes somewhere,throwing clothes somewhere after holding a picture,0.5186164379119873,0.5292688608169556,False
DA7E9,before,DA7E9_0.0_13.7.mp4,DA7E9_21.8_28.4.mp4,holding some food before putting a book somewhere,putting a book somewhere before holding some food,0.5019946098327637,0.47357556223869324,True
DA7E9,after,DA7E9_0.0_13.7.mp4,DA7E9_21.8_28.4.mp4,putting a book somewhere after holding some food,holding some food after putting a book somewhere,0.5037916898727417,0.46450844407081604,True
SVEWD,before,SVEWD_0.0_6.0.mp4,SVEWD_14.2_21.3.mp4,working on paper/notebook before someone is standing up from somewhere,someone is standing up from somewhere before working on paper/notebook,0.41311267018318176,0.4722581207752228,False
SVEWD,after,SVEWD_0.0_6.0.mp4,SVEWD_14.2_21.3.mp4,someone is standing up from somewhere after working on paper/notebook,working on paper/notebook after someone is standing up from somewhere,0.46337583661079407,0.46538010239601135,False
W5GEK,before,W5GEK_0.0_5.1.mp4,W5GEK_28.0_31.0.mp4,walking through a doorway before turning on a light,turning on a light before walking through a doorway,0.514702320098877,0.3888104557991028,True
