video_id,conjugate,event1_clip,event2_clip,caption,distractor_caption,sim_positive,sim_negative,correct
BVX8X,before,BVX8X_1.9_15.9.mp4,BVX8X_17.1_22.4.mp4,holding a phone/camera before someone is eating something,someone is eating something before holding a phone/camera,0.3427906930446625,0.34932786226272583,False
BVX8X,after,BVX8X_1.9_15.9.mp4,BVX8X_17.1_22.4.mp4,someone is eating something after holding a phone/camera,holding a phone/camera after someone is eating something,0.3427906930446625,0.34932786226272583,False
ZC017,before,ZC017_0.0_9.3.mp4,ZC017_10.2_18.8.mp4,sitting on sofa/couch before tidying up a table,tidying up a table before sitting on sofa/couch,0.34955817461013794,0.3249827027320862,True
ZC017,after,ZC017_0.0_9.3.mp4,ZC017_10.2_18.8.mp4,tidying up a table after sitting on sofa/couch,sitting on sofa/couch after tidying up a table,0.34955817461013794,0.3249827027320862,True
G3OUM,before,G3OUM_3.4_17.7.mp4,G3OUM_18.7_23.1.mp4,someone is cooking something before taking a broom from somewhere,taking a broom from somewhere before someone is cooking something,0.384138286113739,0.372253954410553,True
G3OUM,after,G3OUM_3.4_17.7.mp4,G3OUM_18.7_23.1.mp4,taking a broom from somewhere after someone is cooking something,someone is cooking something after taking a broom from somewhere,0.384138286113739,0.372253954410553,True
IAHN3,before,IAHN3_1.0_8.9.mp4,IAHN3_9.2_30.3.mp4,someone is smiling before holding a phone/camera,holding a phone/camera before someone is smiling,0.2949947118759155,0.33656108379364014,False
IAHN3,after,IAHN3_1.0_8.9.mp4,IAHN3_9.2_30.3.mp4,holding a phone/camera after someone is smiling,someone is smiling after holding a phone/camera,0.2949947118759155,0.33656108379364014,False
C4E9X,before,C4E9X_0.0_11.1.mp4,C4E9X_13.5_21.5.mp4,pouring something into a cup/glass/bottle before putting a cup/glass/bottle somewhere,putting a cup/glass/bottle somewhere before pouring something into a cup/glass/bottle,0.3322702646255493,0.34354668855667114,False
C4E9X,after,C4E9X_0.0_11.1.mp4,C4E9X_13.5_21.5.mp4,putting a cup/glass/bottle somewhere after pouring something into a cup/glass/bottle,pouring something into a cup/glass/bottle after putting a cup/glass/bottle somewhere,0.3322702646255493,0.34354668855667114,False
FM078,before,FM078_0.2_12.4.mp4,FM078_12.7_19.8.mp4,tidying up a table before opening a closet/cabinet,opening a closet/cabinet before tidying up a table,0.4550991654396057,0.4499683380126953,True
FM078,after,FM078_0.2_12.4.mp4,FM078_12.7_19.8.mp4,opening a closet/cabinet after tidying up a table,tidying up a table after opening a closet/cabinet,0.4550991654396057,0.4499683380126953,True
EP19T,before,EP19T_3.5_8.7.mp4,EP19T_14.2_26.3.mp4,walking through a doorway before taking a picture of something,taking a picture of something before walking through a doorway,0.46746283769607544,0.4443897306919098,True
EP19T,after,EP19T_3.5_8.7.mp4,EP19T_14.2_26.3.mp4,taking a picture of something after walking through a doorway,walking through a doorway after taking a picture of something,0.46746283769607544,0.4443897306919098,True
MLBTH,before,MLBTH_0.0_8.0.mp4,MLBTH_9.5_15.6.mp4,opening a laptop before taking food from somewhere,taking food from somewhere before opening a laptop,0.46211761236190796,0.44188347458839417,True
MLBTH,after,MLBTH_0.0_8.0.mp4,MLBTH_9.5_15.6.mp4,taking food from somewhere after opening a laptop,opening a laptop after taking food from somewhere,0.46211761236190796,0.44188347458839417,True
8SAEO,before,8SAEO_0.0_4.7.mp4,8SAEO_18.6_27.6.mp4,watching something/someone/themselves in a mirror before someone is dressing,someone is dressing before watching something/someone/themselves in a mirror,0.33690404891967773,0.36362606287002563,False
8SAEO,after,8SAEO_0.0_4.7.mp4,8SAEO_18.6_27.6.mp4,someone is dressing after watching something/someone/themselves in a mirror,watching something/someone/themselves in a mirror after someone is dressing,0.33690404891967773,0.36362606287002563,False
LSH63,before,LSH63_2.7_8.0.mp4,LSH63_10.0_16.9.mp4,walking through a doorway before putting a bag somewhere,putting a bag somewhere before walking through a doorway,0.3721766471862793,0.3786827027797699,False
LSH63,after,LSH63_2.7_8.0.mp4,LSH63_10.0_16.9.mp4,putting a bag somewhere after walking through a doorway,walking through a doorway after putting a bag somewhere,0.3721766471862793,0.3786827027797699,False
QIT2W,before,QIT2W_0.0_14.1.mp4,QIT2W_17.5_25.4.mp4,working/playing on a laptop before putting some food somewhere,putting some food somewhere before working/playing on a laptop,0.35659658908843994,0.3330257534980774,True
QIT2W,after,QIT2W_0.0_14.1.mp4,QIT2W_17.5_25.4.mp4,putting some food somewhere after working/playing on a laptop,working/playing on a laptop after putting some food somewhere,0.35659658908843994,0.3330257534980774,True
5B4HF,before,5B4HF_0.0_10.5.mp4,5B4HF_13.0_18.3.mp4,drinking from a cup/glass/bottle before putting something on a shelf,putting something on a shelf before drinking from a cup/glass/bottle,0.2740620970726013,0.2655647099018097,True
5B4HF,after,5B4HF_0.0_10.5.mp4,5B4HF_13.0_18.3.mp4,putting something on a shelf after drinking from a cup/glass/bottle,drinking from a cup/glass/bottle after putting something on a shelf,0.2740620970726013,0.2655647099018097,True
QEFFJ,before,QEFFJ_0.0_15.1.mp4,QEFFJ_20.7_27.0.mp4,holding a mirror before someone is standing up from somewhere,someone is standing up from somewhere before holding a mirror,0.3027452826499939,0.2903781235218048,True
QEFFJ,after,QEFFJ_0.0_15.1.mp4,QEFFJ_20.7_27.0.mp4,someone is standing up from somewhere after holding a mirror,holding a mirror after someone is standing up from somewhere,0.3027452826499939,0.2903781235218048,True
VAIVN,before,VAIVN_0.0_10.5.mp4,VAIVN_10.8_24.8.mp4,watching/reading/looking at a book before snuggling with a blanket,snuggling with a blanket before watching/reading/looking at a book,0.33403655886650085,0.35120508074760437,False
VAIVN,after,VAIVN_0.0_10.5.mp4,VAIVN_10.8_24.8.mp4,snuggling with a blanket after watching/reading/looking at a book,watching/reading/looking at a book after snuggling with a blanket,0.33403655886650085,0.35120508074760437,False
3H1EA,before,3H1EA_0.0_6.3.mp4,3H1EA_7.1_13.3.mp4,watching/reading/looking at a book before taking a cup/glass/bottle from somewhere,taking a cup/glass/bottle from somewhere before watching/reading/looking at a book,0.3125680088996887,0.32335761189460754,False
3H1EA,after,3H1EA_0.0_6.3.mp4,3H1EA_7.1_13.3.mp4,taking a cup/glass/bottle from somewhere after watching/reading/looking at a book,watching/reading/looking at a book after taking a cup/glass/bottle from somewhere,0.3125680088996887,0.32335761189460754,False
AOBWQ,before,AOBWQ_0.5_19.8.mp4,AOBWQ_22.7_30.3.mp4,taking some clothes from somewhere before throwing clothes somewhere,throwing clothes somewhere before taking some clothes from somewhere,0.43395376205444336,0.4577373266220093,False
AOBWQ,after,AOBWQ_0.5_19.8.mp4,AOBWQ_22.7_30.3.mp4,throwing clothes somewhere after taking some clothes from somewhere,taking some clothes from somewhere after throwing clothes somewhere,0.43395376205444336,0.4577373266220093,False
SQKE4,before,SQKE4_0.0_9.5.mp4,SQKE4_9.7_23.2.mp4,holding a cup/glass/bottle of something before tidying up with a broom,tidying up with a broom before holding a cup/glass/bottle of something,0.30003273487091064,0.3027966320514679,False
SQKE4,after,SQKE4_0.0_9.5.mp4,SQKE4_9.7_23.2.mp4,tidying up with a broom after holding a cup/glass/bottle of something,holding a cup/glass/bottle of something after tidying up with a broom,0.30003273487091064,0.3027966320514679,False
7H7PN,before,7H7PN_0.0_5.2.mp4,7H7PN_8.4_29.0.mp4,opening a bag before holding some clothes,holding some clothes before opening a bag,0.3810676336288452,0.3990853726863861,False
7H7PN,after,7H7PN_0.0_5.2.mp4,7H7PN_8.4_29.0.mp4,holding some clothes after opening a bag,opening a bag after holding some clothes,0.3810676336288452,0.3990853726863861,False
AVSPS,before,AVSPS_0.0_28.9.mp4,AVSPS_29.0_34.3.mp4,holding some food before holding a broom,holding a broom before holding some food,0.2876235246658325,0.2786993682384491,True
AVSPS,after,AVSPS_0.0_28.9.mp4,AVSPS_29.0_34.3.mp4,holding a broom after holding some food,holding some food after holding a broom,0.2876235246658325,0.2786993682384491,True
D8BTU,before,D8BTU_3.6_9.4.mp4,D8BTU_10.5_20.7.mp4,someone is going from standing to sitting before tidying up a closet/cabinet,tidying up a closet/cabinet before someone is going from standing to sitting,0.4356474280357361,0.4286807179450989,True
D8BTU,after,D8BTU_3.6_9.4.mp4,D8BTU_10.5_20.7.mp4,tidying up a closet/cabinet after someone is going from standing to sitting,someone is going from standing to sitting after tidying up a closet/cabinet,0.4356474280357361,0.4286807179450989,True
RJDH2,before,RJDH2_0.0_16.8.mp4,RJDH2_17.0_26.6.mp4,sitting at a table before throwing a pillow somewhere,throwing a pillow somewhere before sitting at a table,0.19203948974609375,0.2206401526927948,False
RJDH2,after,RJDH2_0.0_16.8.mp4,RJDH2_17.0_26.6.mp4,throwing a pillow somewhere after sitting at a table,sitting at a table after throwing a pillow somewhere,0.19203948974609375,0.2206401526927948,False
5SGU6,before,5SGU6_0.0_4.9.mp4,5SGU6_6.0_11.0.mp4,holding a bag before putting something on a shelf,putting something on a shelf before holding a bag,0.4565982520580292,0.3952663540840149,True
5SGU6,after,5SGU6_0.0_4.9.mp4,5SGU6_6.0_11.0.mp4,putting something on a shelf after holding a bag,holding a bag after putting something on a shelf,0.4565982520580292,0.3952663540840149,True
E40VQ,before,E40VQ_0.0_2.7.mp4,E40VQ_5.8_21.5.mp4,walking through a doorway before working on paper/notebook,working on paper/notebook before walking through a doorway,0.4433107376098633,0.42870640754699707,True
E40VQ,after,E40VQ_0.0_2.7.mp4,E40VQ_5.8_21.5.mp4,working on paper/notebook after walking through a doorway,walking through a doorway after working on paper/notebook,0.4433107376098633,0.42870640754699707,True
BOHLW,before,BOHLW_0.0_17.4.mp4,BOHLW_23.9_29.8.mp4,holding a cup/glass/bottle of something before turning on a light,turning on a light before holding a cup/glass/bottle of something,0.18620330095291138,0.18986457586288452,False
BOHLW,after,BOHLW_0.0_17.4.mp4,BOHLW_23.9_29.8.mp4,turning on a light after holding a cup/glass/bottle of something,holding a cup/glass/bottle of something after turning on a light,0.18620330095291138,0.18986457586288452,False
PU53O,before,PU53O_0.0_3.1.mp4,PU53O_3.7_9.7.mp4,holding some clothes before tidying something on the floor,tidying something on the floor before holding some clothes,0.46982043981552124,0.4508940577507019,True
PU53O,after,PU53O_0.0_3.1.mp4,PU53O_3.7_9.7.mp4,tidying something on the floor after holding some clothes,holding some clothes after tidying something on the floor,0.46982043981552124,0.4508940577507019,True
Y49WR,before,Y49WR_3.9_14.3.mp4,Y49WR_15.4_23.0.mp4,someone is dressing before taking a picture of something,taking a picture of something before someone is dressing,0.4004758596420288,0.4165099859237671,False
Y49WR,after,Y49WR_3.9_14.3.mp4,Y49WR_15.4_23.0.mp4,taking a picture of something after someone is dressing,someone is dressing after taking a picture of something,0.4004758596420288,0.4165099859237671,False
5LPJL,before,5LPJL_0.0_15.2.mp4,5LPJL_16.7_28.5.mp4,washing something with a towel before tidying up a table,tidying up a table before washing something with a towel,0.27220702171325684,0.25049883127212524,True
5LPJL,after,5LPJL_0.0_15.2.mp4,5LPJL_16.7_28.5.mp4,tidying up a table after washing something with a towel,washing something with a towel after tidying up a table,0.27220702171325684,0.25049883127212524,True
M2XIS,before,M2XIS_0.0_6.4.mp4,M2XIS_9.4_15.1.mp4,putting a laptop somewhere before working at a table,working at a table before putting a laptop somewhere,0.48571670055389404,0.4713847041130066,True
M2XIS,after,M2XIS_0.0_6.4.mp4,M2XIS_9.4_15.1.mp4,working at a table after putting a laptop somewhere,putting a laptop somewhere after working at a table,0.48571670055389404,0.4713847041130066,True
MYB7P,before,MYB7P_0.0_11.6.mp4,MYB7P_12.3_17.2.mp4,holding a phone/camera before holding a sandwich,holding a sandwich before holding a phone/camera,0.42100682854652405,0.420265793800354,True
MYB7P,after,MYB7P_0.0_11.6.mp4,MYB7P_12.3_17.2.mp4,holding a sandwich after holding a phone/camera,holding a phone/camera after holding a sandwich,0.42100682854652405,0.420265793800354,True
V4YCA,before,V4YCA_0.0_13.9.mp4,V4YCA_14.8_21.4.mp4,someone is laughing before putting some food somewhere,putting some food somewhere before someone is laughing,0.18291950225830078,0.16768226027488708,True
V4YCA,after,V4YCA_0.0_13.9.mp4,V4YCA_14.8_21.4.mp4,putting some food somewhere after someone is laughing,someone is laughing after putting some food somewhere,0.18291950225830078,0.16768226027488708,True
KTL2G,before,KTL2G_0.0_10.5.mp4,KTL2G_13.7_19.0.mp4,holding a broom before turning off a light,turning off a light before holding a broom,0.3028934895992279,0.27629798650741577,True
KTL2G,after,KTL2G_0.0_10.5.mp4,KTL2G_13.7_19.0.mp4,turning off a light after holding a broom,holding a broom after turning off a light,0.3028934895992279,0.27629798650741577,True
LK3LF,before,LK3LF_7.3_13.8.mp4,LK3LF_13.9_25.4.mp4,taking a cup/glass/bottle from somewhere before putting a pillow somewhere,putting a pillow somewhere before taking a cup/glass/bottle from somewhere,0.2984444200992584,0.2993910014629364,False
LK3LF,after,LK3LF_7.3_13.8.mp4,LK3LF_13.9_25.4.mp4,putting a pillow somewhere after taking a cup/glass/bottle from somewhere,taking a cup/glass/bottle from somewhere after putting a pillow somewhere,0.2984444200992584,0.2993910014629364,False
TOOYI,before,TOOYI_0.0_4.7.mp4,TOOYI_8.0_21.2.mp4,opening a box before someone is smiling,someone is smiling before opening a box,0.4184074401855469,0.39703989028930664,True
TOOYI,after,TOOYI_0.0_4.7.mp4,TOOYI_8.0_21.2.mp4,someone is smiling after opening a box,opening a box after someone is smiling,0.4184074401855469,0.39703989028930664,True
FQS7O,before,FQS7O_0.0_15.8.mp4,FQS7O_20.5_24.5.mp4,working on paper/notebook before taking a towel/s from somewhere,taking a towel/s from somewhere before working on paper/notebook,0.303989052772522,0.2925741672515869,True
FQS7O,after,FQS7O_0.0_15.8.mp4,FQS7O_20.5_24.5.mp4,taking a towel/s from somewhere after working on paper/notebook,working on paper/notebook after taking a towel/s from somewhere,0.303989052772522,0.2925741672515869,True
B4F0T,before,B4F0T_0.7_10.9.mp4,B4F0T_17.0_24.1.mp4,holding some medicine before someone is going from standing to sitting,someone is going from standing to sitting before holding some medicine,0.34544920921325684,0.3388792872428894,True
B4F0T,after,B4F0T_0.7_10.9.mp4,B4F0T_17.0_24.1.mp4,someone is going from standing to sitting after holding some medicine,holding some medicine after someone is going from standing to sitting,0.34544920921325684,0.3388792872428894,True
UTAGQ,before,UTAGQ_0.0_5.9.mp4,UTAGQ_6.4_11.5.mp4,someone is eating something before taking a book from somewhere,taking a book from somewhere before someone is eating something,0.38937246799468994,0.38088446855545044,True
UTAGQ,after,UTAGQ_0.0_5.9.mp4,UTAGQ_6.4_11.5.mp4,taking a book from somewhere after someone is eating something,someone is eating something after taking a book from somewhere,0.38937246799468994,0.38088446855545044,True
0USFX,before,0USFX_0.0_4.2.mp4,0USFX_13.0_17.5.mp4,opening a closet/cabinet before putting a bag somewhere,putting a bag somewhere before opening a closet/cabinet,0.48912957310676575,0.4673771262168884,True
0USFX,after,0USFX_0.0_4.2.mp4,0USFX_13.0_17.5.mp4,putting a bag somewhere after opening a closet/cabinet,opening a closet/cabinet after putting a bag somewhere,0.48912957310676575,0.4673771262168884,True
WZCPT,before,WZCPT_3.4_10.5.mp4,WZCPT_11.6_18.5.mp4,opening a refrigerator before taking food from somewhere,taking food from somewhere before opening a refrigerator,0.401531457901001,0.38951265811920166,True
WZCPT,after,WZCPT_3.4_10.5.mp4,WZCPT_11.6_18.5.mp4,taking food from somewhere after opening a refrigerator,opening a refrigerator after taking food from somewhere,0.401531457901001,0.38951265811920166,True
ZPAM8,before,ZPAM8_1.0_8.3.mp4,ZPAM8_8.8_13.9.mp4,walking through a doorway before putting something on a table,putting something on a table before walking through a doorway,0.3055538535118103,0.3123403787612915,False
ZPAM8,after,ZPAM8_1.0_8.3.mp4,ZPAM8_8.8_13.9.mp4,putting something on a table after walking through a doorway,walking through a doorway after putting something on a table,0.3055538535118103,0.3123403787612915,False
XS7RN,before,XS7RN_6.7_17.4.mp4,XS7RN_21.4_26.9.mp4,putting a box somewhere before throwing a book somewhere,throwing a book somewhere before putting a box somewhere,0.26472562551498413,0.21521370112895966,True
XS7RN,after,XS7RN_6.7_17.4.mp4,XS7RN_21.4_26.9.mp4,throwing a book somewhere after putting a box somewhere,putting a box somewhere after throwing a book somewhere,0.26472562551498413,0.21521370112895966,True
QOWXK,before,QOWXK_3.8_10.1.mp4,QOWXK_15.7_45.1.mp4,someone is going from standing to sitting before sitting on the floor,sitting on the floor before someone is going from standing to sitting,0.3529946208000183,0.3641050159931183,False
QOWXK,after,QOWXK_3.8_10.1.mp4,QOWXK_15.7_45.1.mp4,sitting on the floor after someone is going from standing to sitting,someone is going from standing to sitting after sitting on the floor,0.3529946208000183,0.3641050159931183,False
K0X80,before,K0X80_3.1_8.6.mp4,K0X80_18.5_24.5.mp4,opening a door before walking through a doorway,walking through a doorway before opening a door,0.38886693120002747,0.3936097025871277,False
K0X80,after,K0X80_3.1_8.6.mp4,K0X80_18.5_24.5.mp4,walking through a doorway after opening a door,opening a door after walking through a doorway,0.38886693120002747,0.3936097025871277,False
44Y6S,before,44Y6S_9.1_14.6.mp4,44Y6S_35.4_41.3.mp4,taking something from a box before putting a phone/camera somewhere,putting a phone/camera somewhere before taking something from a box,0.4355485737323761,0.42080724239349365,True
44Y6S,after,44Y6S_9.1_14.6.mp4,44Y6S_35.4_41.3.mp4,putting a phone/camera somewhere after taking something from a box,taking something from a box after putting a phone/camera somewhere,0.4355485737323761,0.42080724239349365,True
59X8N,before,59X8N_0.0_12.1.mp4,59X8N_17.0_24.7.mp4,holding a box before putting a broom somewhere,putting a broom somewhere before holding a box,0.30551064014434814,0.2736179828643799,True
59X8N,after,59X8N_0.0_12.1.mp4,59X8N_17.0_24.7.mp4,putting a broom somewhere after holding a box,holding a box after putting a broom somewhere,0.30551064014434814,0.2736179828643799,True
1LZ53,before,1LZ53_1.7_13.0.mp4,1LZ53_18.4_29.6.mp4,sitting in a bed before opening a window,opening a window before sitting in a bed,0.41369420289993286,0.41298916935920715,True
1LZ53,after,1LZ53_1.7_13.0.mp4,1LZ53_18.4_29.6.mp4,opening a window after sitting in a bed,sitting in a bed after opening a window,0.41369420289993286,0.41298916935920715,True
ZAN58,before,ZAN58_7.4_12.6.mp4,ZAN58_13.1_28.7.mp4,putting a box somewhere before someone is sneezing,someone is sneezing before putting a box somewhere,0.4086553454399109,0.42834556102752686,False
ZAN58,after,ZAN58_7.4_12.6.mp4,ZAN58_13.1_28.7.mp4,someone is sneezing after putting a box somewhere,putting a box somewhere after someone is sneezing,0.4086553454399109,0.42834556102752686,False
8F17S,before,8F17S_0.0_4.5.mp4,8F17S_10.0_15.8.mp4,drinking from a cup/glass/bottle before opening a closet/cabinet,opening a closet/cabinet before drinking from a cup/glass/bottle,0.27257534861564636,0.24918994307518005,True
8F17S,after,8F17S_0.0_4.5.mp4,8F17S_10.0_15.8.mp4,opening a closet/cabinet after drinking from a cup/glass/bottle,drinking from a cup/glass/bottle after opening a closet/cabinet,0.27257534861564636,0.24918994307518005,True
673VM,before,673VM_91.7_102.8.mp4,673VM_104.2_161.8.mp4,walking through a doorway before holding a phone/camera,holding a phone/camera before walking through a doorway,0.5021007061004639,0.49953049421310425,True
673VM,after,673VM_91.7_102.8.mp4,673VM_104.2_161.8.mp4,holding a phone/camera after walking through a doorway,walking through a doorway after holding a phone/camera,0.5021007061004639,0.49953049421310425,True
WREDC,before,WREDC_0.0_12.0.mp4,WREDC_14.9_22.9.mp4,taking a cup/glass/bottle from somewhere before putting a dish/es somewhere,putting a dish/es somewhere before taking a cup/glass/bottle from somewhere,0.2675212025642395,0.24140387773513794,True
WREDC,after,WREDC_0.0_12.0.mp4,WREDC_14.9_22.9.mp4,putting a dish/es somewhere after taking a cup/glass/bottle from somewhere,taking a cup/glass/bottle from somewhere after putting a dish/es somewhere,0.2675212025642395,0.24140387773513794,True
1P7GJ,before,1P7GJ_15.1_22.3.mp4,1P7GJ_28.5_34.5.mp4,opening a closet/cabinet before putting a broom somewhere,putting a broom somewhere before opening a closet/cabinet,0.3202153444290161,0.3199193775653839,True
1P7GJ,after,1P7GJ_15.1_22.3.mp4,1P7GJ_28.5_34.5.mp4,putting a broom somewhere after opening a closet/cabinet,opening a closet/cabinet after putting a broom somewhere,0.3202153444290161,0.3199193775653839,True
AXJUB,before,AXJUB_4.7_13.0.mp4,AXJUB_25.7_35.1.mp4,taking food from somewhere before putting a sandwich somewhere,putting a sandwich somewhere before taking food from somewhere,0.3006887137889862,0.28964972496032715,True
AXJUB,after,AXJUB_4.7_13.0.mp4,AXJUB_25.7_35.1.mp4,putting a sandwich somewhere after taking food from somewhere,taking food from somewhere after putting a sandwich somewhere,0.3006887137889862,0.28964972496032715,True
JCNHL,before,JCNHL_0.4_8.8.mp4,JCNHL_12.0_21.4.mp4,someone is smiling before throwing clothes somewhere,throwing clothes somewhere before someone is smiling,0.15248486399650574,0.16084638237953186,False
JCNHL,after,JCNHL_0.4_8.8.mp4,JCNHL_12.0_21.4.mp4,throwing clothes somewhere after someone is smiling,someone is smiling after throwing clothes somewhere,0.15248486399650574,0.16084638237953186,False
Y5826,before,Y5826_0.0_4.2.mp4,Y5826_10.8_33.5.mp4,someone is cooking something before throwing food somewhere,throwing food somewhere before someone is cooking something,0.3264550268650055,0.3023909628391266,True
Y5826,after,Y5826_0.0_4.2.mp4,Y5826_10.8_33.5.mp4,throwing food somewhere after someone is cooking something,someone is cooking something after throwing food somewhere,0.3264550268650055,0.3023909628391266,True
JL5O0,before,JL5O0_1.1_7.7.mp4,JL5O0_8.2_14.7.mp4,walking through a doorway before eating a sandwich,eating a sandwich before walking through a doorway,0.46874600648880005,0.4605429768562317,True
JL5O0,after,JL5O0_1.1_7.7.mp4,JL5O0_8.2_14.7.mp4,eating a sandwich after walking through a doorway,walking through a doorway after eating a sandwich,0.46874600648880005,0.4605429768562317,True
F3RM9,before,F3RM9_0.0_4.0.mp4,F3RM9_4.2_9.3.mp4,sitting in a bed before smiling at a book,smiling at a book before sitting in a bed,0.24489125609397888,0.23073428869247437,True
F3RM9,after,F3RM9_0.0_4.0.mp4,F3RM9_4.2_9.3.mp4,smiling at a book after sitting in a bed,sitting in a bed after smiling at a book,0.24489125609397888,0.23073428869247437,True
TMA9G,before,TMA9G_1.3_13.5.mp4,TMA9G_19.5_25.3.mp4,holding some food before closing a door,closing a door before holding some food,0.24152261018753052,0.2361084520816803,True
TMA9G,after,TMA9G_1.3_13.5.mp4,TMA9G_19.5_25.3.mp4,closing a door after holding some food,holding some food after closing a door,0.24152261018753052,0.2361084520816803,True
Y3NN8,before,Y3NN8_0.0_22.5.mp4,Y3NN8_23.9_34.0.mp4,sitting in a bed before grasping onto a doorknob,grasping onto a doorknob before sitting in a bed,0.35643577575683594,0.33484748005867004,True
Y3NN8,after,Y3NN8_0.0_22.5.mp4,Y3NN8_23.9_34.0.mp4,grasping onto a doorknob after sitting in a bed,sitting in a bed after grasping onto a doorknob,0.35643577575683594,0.33484748005867004,True
AF5BS,before,AF5BS_0.0_17.7.mp4,AF5BS_23.4_28.6.mp4,holding a phone/camera before someone is standing up from somewhere,someone is standing up from somewhere before holding a phone/camera,0.2763216495513916,0.2730041742324829,True
AF5BS,after,AF5BS_0.0_17.7.mp4,AF5BS_23.4_28.6.mp4,someone is standing up from somewhere after holding a phone/camera,holding a phone/camera after someone is standing up from somewhere,0.2763216495513916,0.2730041742324829,True
WENGZ,before,WENGZ_0.2_7.8.mp4,WENGZ_13.7_18.8.mp4,opening a refrigerator before closing a refrigerator,closing a refrigerator before opening a refrigerator,0.282552033662796,0.2765774726867676,True
WENGZ,after,WENGZ_0.2_7.8.mp4,WENGZ_13.7_18.8.mp4,closing a refrigerator after opening a refrigerator,opening a refrigerator after closing a refrigerator,0.282552033662796,0.2765774726867676,True
450TW,before,450TW_1.4_8.7.mp4,450TW_10.0_16.3.mp4,opening a book before someone is eating something,someone is eating something before opening a book,0.30452266335487366,0.3281940221786499,False
450TW,after,450TW_1.4_8.7.mp4,450TW_10.0_16.3.mp4,someone is eating something after opening a book,opening a book after someone is eating something,0.30452266335487366,0.3281940221786499,False
B0XI9,before,B0XI9_0.0_4.7.mp4,B0XI9_5.1_22.1.mp4,walking through a doorway before someone is eating something,someone is eating something before walking through a doorway,0.4015929400920868,0.40843939781188965,False
B0XI9,after,B0XI9_0.0_4.7.mp4,B0XI9_5.1_22.1.mp4,someone is eating something after walking through a doorway,walking through a doorway after someone is eating something,0.4015929400920868,0.40843939781188965,False
