video_id,conjugate,event1_clip,event2_clip,caption,distractor_caption,sim_positive,sim_negative,correct
BVX8X,before,BVX8X_1.9_15.9.mp4,BVX8X_17.1_22.4.mp4,holding a phone/camera before someone is eating something,someone is eating something before holding a phone/camera,0.5321425795555115,0.38626062870025635,True
BVX8X,after,BVX8X_1.9_15.9.mp4,BVX8X_17.1_22.4.mp4,someone is eating something after holding a phone/camera,holding a phone/camera after someone is eating something,0.44737544655799866,0.5137912034988403,False
ZC017,before,ZC017_0.0_9.3.mp4,ZC017_10.2_18.8.mp4,sitting on sofa/couch before tidying up a table,tidying up a table before sitting on sofa/couch,0.6027262806892395,0.5207003355026245,True
ZC017,after,ZC017_0.0_9.3.mp4,ZC017_10.2_18.8.mp4,tidying up a table after sitting on sofa/couch,sitting on sofa/couch after tidying up a table,0.5087572932243347,0.6197341680526733,False
G3OUM,before,G3OUM_3.4_17.7.mp4,G3OUM_18.7_23.1.mp4,someone is cooking something before taking a broom from somewhere,taking a broom from somewhere before someone is cooking something,0.44942712783813477,0.4612595736980438,False
G3OUM,after,G3OUM_3.4_17.7.mp4,G3OUM_18.7_23.1.mp4,taking a broom from somewhere after someone is cooking something,someone is cooking something after taking a broom from somewhere,0.4634582996368408,0.4472953677177429,True
IAHN3,before,IAHN3_1.0_8.9.mp4,IAHN3_9.2_30.3.mp4,someone is smiling before holding a phone/camera,holding a phone/camera before someone is smiling,0.4910443425178528,0.5391210317611694,False
IAHN3,after,IAHN3_1.0_8.9.mp4,IAHN3_9.2_30.3.mp4,holding a phone/camera after someone is smiling,someone is smiling after holding a phone/camera,0.49548274278640747,0.4934498965740204,True
C4E9X,before,C4E9X_0.0_11.1.mp4,C4E9X_13.5_21.5.mp4,pouring something into a cup/glass/bottle before putting a cup/glass/bottle somewhere,putting a cup/glass/bottle somewhere before pouring something into a cup/glass/bottle,0.47475939989089966,0.502657949924469,False
C4E9X,after,C4E9X_0.0_11.1.mp4,C4E9X_13.5_21.5.mp4,putting a cup/glass/bottle somewhere after pouring something into a cup/glass/bottle,pouring something into a cup/glass/bottle after putting a cup/glass/bottle somewhere,0.5328531265258789,0.46563827991485596,True
FM078,before,FM078_0.2_12.4.mp4,FM078_12.7_19.8.mp4,tidying up a table before opening a closet/cabinet,opening a closet/cabinet before tidying up a table,0.5929743051528931,0.4881055951118469,True
FM078,after,FM078_0.2_12.4.mp4,FM078_12.7_19.8.mp4,opening a closet/cabinet after tidying up a table,tidying up a table after opening a closet/cabinet,0.5414603352546692,0.5242276191711426,True
EP19T,before,EP19T_3.5_8.7.mp4,EP19T_14.2_26.3.mp4,walking through a doorway before taking a picture of something,taking a picture of something before walking through a doorway,0.5100140571594238,0.4905407130718231,True
EP19T,after,EP19T_3.5_8.7.mp4,EP19T_14.2_26.3.mp4,taking a picture of something after walking through a doorway,walking through a doorway after taking a picture of something,0.5134003162384033,0.48053455352783203,True
MLBTH,before,MLBTH_0.0_8.0.mp4,MLBTH_9.5_15.6.mp4,opening a laptop before taking food from somewhere,taking food from somewhere before opening a laptop,0.4746287167072296,0.42482927441596985,True
MLBTH,after,MLBTH_0.0_8.0.mp4,MLBTH_9.5_15.6.mp4,taking food from somewhere after opening a laptop,opening a laptop after taking food from somewhere,0.43682220578193665,0.45569977164268494,False
8SAEO,before,8SAEO_0.0_4.7.mp4,8SAEO_18.6_27.6.mp4,watching something/someone/themselves in a mirror before someone is dressing,someone is dressing before watching something/someone/themselves in a mirror,0.6157866716384888,0.6479508876800537,False
8SAEO,after,8SAEO_0.0_4.7.mp4,8SAEO_18.6_27.6.mp4,someone is dressing after watching something/someone/themselves in a mirror,watching something/someone/themselves in a mirror after someone is dressing,0.64287269115448,0.6052924394607544,True
LSH63,before,LSH63_2.7_8.0.mp4,LSH63_10.0_16.9.mp4,walking through a doorway before putting a bag somewhere,putting a bag somewhere before walking through a doorway,0.45007774233818054,0.5055605173110962,False
LSH63,after,LSH63_2.7_8.0.mp4,LSH63_10.0_16.9.mp4,putting a bag somewhere after walking through a doorway,walking through a doorway after putting a bag somewhere,0.5637596845626831,0.4270852208137512,True
QIT2W,before,QIT2W_0.0_14.1.mp4,QIT2W_17.5_25.4.mp4,working/playing on a laptop before putting some food somewhere,putting some food somewhere before working/playing on a laptop,0.4701249301433563,0.48423248529434204,False
QIT2W,after,QIT2W_0.0_14.1.mp4,QIT2W_17.5_25.4.mp4,putting some food somewhere after working/playing on a laptop,working/playing on a laptop after putting some food somewhere,0.5205320119857788,0.48322436213493347,True
5B4HF,before,5B4HF_0.0_10.5.mp4,5B4HF_13.0_18.3.mp4,drinking from a cup/glass/bottle before putting something on a shelf,putting something on a shelf before drinking from a cup/glass/bottle,0.40171319246292114,0.4413294792175293,False
5B4HF,after,5B4HF_0.0_10.5.mp4,5B4HF_13.0_18.3.mp4,putting something on a shelf after drinking from a cup/glass/bottle,drinking from a cup/glass/bottle after putting something on a shelf,0.44882282614707947,0.4027259349822998,True
QEFFJ,before,QEFFJ_0.0_15.1.mp4,QEFFJ_20.7_27.0.mp4,holding a mirror before someone is standing up from somewhere,someone is standing up from somewhere before holding a mirror,0.5345752239227295,0.4427216947078705,True
QEFFJ,after,QEFFJ_0.0_15.1.mp4,QEFFJ_20.7_27.0.mp4,someone is standing up from somewhere after holding a mirror,holding a mirror after someone is standing up from somewhere,0.5010843276977539,0.5176616907119751,False
VAIVN,before,VAIVN_0.0_10.5.mp4,VAIVN_10.8_24.8.mp4,watching/reading/looking at a book before snuggling with a blanket,snuggling with a blanket before watching/reading/looking at a book,0.5611045360565186,0.6524536609649658,False
VAIVN,after,VAIVN_0.0_10.5.mp4,VAIVN_10.8_24.8.mp4,snuggling with a blanket after watching/reading/looking at a book,watching/reading/looking at a book after snuggling with a blanket,0.6317435503005981,0.6213102340698242,True
3H1EA,before,3H1EA_0.0_6.3.mp4,3H1EA_7.1_13.3.mp4,watching/reading/looking at a book before taking a cup/glass/bottle from somewhere,taking a cup/glass/bottle from somewhere before watching/reading/looking at a book,0.5041189789772034,0.5145270824432373,False
3H1EA,after,3H1EA_0.0_6.3.mp4,3H1EA_7.1_13.3.mp4,taking a cup/glass/bottle from somewhere after watching/reading/looking at a book,watching/reading/looking at a book after taking a cup/glass/bottle from somewhere,0.5503683090209961,0.5218501091003418,True
AOBWQ,before,AOBWQ_0.5_19.8.mp4,AOBWQ_22.7_30.3.mp4,taking some clothes from somewhere before throwing clothes somewhere,throwing clothes somewhere before taking some clothes from somewhere,0.6266170740127563,0.6751970052719116,False
AOBWQ,after,AOBWQ_0.5_19.8.mp4,AOBWQ_22.7_30.3.mp4,throwing clothes somewhere after taking some clothes from somewhere,taking some clothes from somewhere after throwing clothes somewhere,0.6744669675827026,0.5624392628669739,True
SQKE4,before,SQKE4_0.0_9.5.mp4,SQKE4_9.7_23.2.mp4,holding a cup/glass/bottle of something before tidying up with a broom,tidying up with a broom before holding a cup/glass/bottle of something,0.49371376633644104,0.5187153816223145,False
SQKE4,after,SQKE4_0.0_9.5.mp4,SQKE4_9.7_23.2.mp4,tidying up with a broom after holding a cup/glass/bottle of something,holding a cup/glass/bottle of something after tidying up with a broom,0.5021495819091797,0.5551315546035767,False
7H7PN,before,7H7PN_0.0_5.2.mp4,7H7PN_8.4_29.0.mp4,opening a bag before holding some clothes,holding some clothes before opening a bag,0.5026171803474426,0.5581117272377014,False
7H7PN,after,7H7PN_0.0_5.2.mp4,7H7PN_8.4_29.0.mp4,holding some clothes after opening a bag,opening a bag after holding some clothes,0.557593822479248,0.5054045915603638,True
AVSPS,before,AVSPS_0.0_28.9.mp4,AVSPS_29.0_34.3.mp4,holding some food before holding a broom,holding a broom before holding some food,0.35824695229530334,0.42001503705978394,False
AVSPS,after,AVSPS_0.0_28.9.mp4,AVSPS_29.0_34.3.mp4,holding a broom after holding some food,holding some food after holding a broom,0.484439492225647,0.3988954424858093,True
D8BTU,before,D8BTU_3.6_9.4.mp4,D8BTU_10.5_20.7.mp4,someone is going from standing to sitting before tidying up a closet/cabinet,tidying up a closet/cabinet before someone is going from standing to sitting,0.48163872957229614,0.5279995799064636,False
D8BTU,after,D8BTU_3.6_9.4.mp4,D8BTU_10.5_20.7.mp4,tidying up a closet/cabinet after someone is going from standing to sitting,someone is going from standing to sitting after tidying up a closet/cabinet,0.4934249818325043,0.5082510113716125,False
RJDH2,before,RJDH2_0.0_16.8.mp4,RJDH2_17.0_26.6.mp4,sitting at a table before throwing a pillow somewhere,throwing a pillow somewhere before sitting at a table,0.42998313903808594,0.44616007804870605,False
RJDH2,after,RJDH2_0.0_16.8.mp4,RJDH2_17.0_26.6.mp4,throwing a pillow somewhere after sitting at a table,sitting at a table after throwing a pillow somewhere,0.4367230534553528,0.4451371431350708,False
5SGU6,before,5SGU6_0.0_4.9.mp4,5SGU6_6.0_11.0.mp4,holding a bag before putting something on a shelf,putting something on a shelf before holding a bag,0.4679158926010132,0.4443216919898987,True
5SGU6,after,5SGU6_0.0_4.9.mp4,5SGU6_6.0_11.0.mp4,putting something on a shelf after holding a bag,holding a bag after putting something on a shelf,0.5068626403808594,0.4802325963973999,True
E40VQ,before,E40VQ_0.0_2.7.mp4,E40VQ_5.8_21.5.mp4,walking through a doorway before working on paper/notebook,working on paper/notebook before walking through a doorway,0.4937558174133301,0.5189557075500488,False
E40VQ,after,E40VQ_0.0_2.7.mp4,E40VQ_5.8_21.5.mp4,working on paper/notebook after walking through a doorway,walking through a doorway after working on paper/notebook,0.4961458742618561,0.49362456798553467,True
BOHLW,before,BOHLW_0.0_17.4.mp4,BOHLW_23.9_29.8.mp4,holding a cup/glass/bottle of something before turning on a light,turning on a light before holding a cup/glass/bottle of something,0.4395831227302551,0.33519941568374634,True
BOHLW,after,BOHLW_0.0_17.4.mp4,BOHLW_23.9_29.8.mp4,turning on a light after holding a cup/glass/bottle of something,holding a cup/glass/bottle of something after turning on a light,0.37071675062179565,0.4638240337371826,False
PU53O,before,PU53O_0.0_3.1.mp4,PU53O_3.7_9.7.mp4,holding some clothes before tidying something on the floor,tidying something on the floor before holding some clothes,0.5691978931427002,0.4911964535713196,True
PU53O,after,PU53O_0.0_3.1.mp4,PU53O_3.7_9.7.mp4,tidying something on the floor after holding some clothes,holding some clothes after tidying something on the floor,0.517181396484375,0.5536985993385315,False
Y49WR,before,Y49WR_3.9_14.3.mp4,Y49WR_15.4_23.0.mp4,someone is dressing before taking a picture of something,taking a picture of something before someone is dressing,0.6384545564651489,0.5397899746894836,True
Y49WR,after,Y49WR_3.9_14.3.mp4,Y49WR_15.4_23.0.mp4,taking a picture of something after someone is dressing,someone is dressing after taking a picture of something,0.5590029954910278,0.6076558828353882,False
5LPJL,before,5LPJL_0.0_15.2.mp4,5LPJL_16.7_28.5.mp4,washing something with a towel before tidying up a table,tidying up a table before washing something with a towel,0.5068086385726929,0.4807530641555786,True
5LPJL,after,5LPJL_0.0_15.2.mp4,5LPJL_16.7_28.5.mp4,tidying up a table after washing something with a towel,washing something with a towel after tidying up a table,0.49801695346832275,0.5328100919723511,False
M2XIS,before,M2XIS_0.0_6.4.mp4,M2XIS_9.4_15.1.mp4,putting a laptop somewhere before working at a table,working at a table before putting a laptop somewhere,0.5807439088821411,0.4946885406970978,True
M2XIS,after,M2XIS_0.0_6.4.mp4,M2XIS_9.4_15.1.mp4,working at a table after putting a laptop somewhere,putting a laptop somewhere after working at a table,0.49886760115623474,0.576907753944397,False
MYB7P,before,MYB7P_0.0_11.6.mp4,MYB7P_12.3_17.2.mp4,holding a phone/camera before holding a sandwich,holding a sandwich before holding a phone/camera,0.5121258497238159,0.48143675923347473,True
MYB7P,after,MYB7P_0.0_11.6.mp4,MYB7P_12.3_17.2.mp4,holding a sandwich after holding a phone/camera,holding a phone/camera after holding a sandwich,0.4470285475254059,0.48199695348739624,False
V4YCA,before,V4YCA_0.0_13.9.mp4,V4YCA_14.8_21.4.mp4,someone is laughing before putting some food somewhere,putting some food somewhere before someone is laughing,0.32171905040740967,0.3977057933807373,False
V4YCA,after,V4YCA_0.0_13.9.mp4,V4YCA_14.8_21.4.mp4,putting some food somewhere after someone is laughing,someone is laughing after putting some food somewhere,0.4596162736415863,0.38182470202445984,True
KTL2G,before,KTL2G_0.0_10.5.mp4,KTL2G_13.7_19.0.mp4,holding a broom before turning off a light,turning off a light before holding a broom,0.48988988995552063,0.4052463471889496,True
KTL2G,after,KTL2G_0.0_10.5.mp4,KTL2G_13.7_19.0.mp4,turning off a light after holding a broom,holding a broom after turning off a light,0.34844255447387695,0.455543577671051,False
LK3LF,before,LK3LF_7.3_13.8.mp4,LK3LF_13.9_25.4.mp4,taking a cup/glass/bottle from somewhere before putting a pillow somewhere,putting a pillow somewhere before taking a cup/glass/bottle from somewhere,0.36546826362609863,0.45616739988327026,False
LK3LF,after,LK3LF_7.3_13.8.mp4,LK3LF_13.9_25.4.mp4,putting a pillow somewhere after taking a cup/glass/bottle from somewhere,taking a cup/glass/bottle from somewhere after putting a pillow somewhere,0.48695921897888184,0.4297948479652405,True
TOOYI,before,TOOYI_0.0_4.7.mp4,TOOYI_8.0_21.2.mp4,opening a box before someone is smiling,someone is smiling before opening a box,0.4318894147872925,0.4340241253376007,False
TOOYI,after,TOOYI_0.0_4.7.mp4,TOOYI_8.0_21.2.mp4,someone is smiling after opening a box,opening a box after someone is smiling,0.43721258640289307,0.4237942397594452,True
FQS7O,before,FQS7O_0.0_15.8.mp4,FQS7O_20.5_24.5.mp4,working on paper/notebook before taking a towel/s from somewhere,taking a towel/s from somewhere before working on paper/notebook,0.3375786542892456,0.4218692183494568,False
FQS7O,after,FQS7O_0.0_15.8.mp4,FQS7O_20.5_24.5.mp4,taking a towel/s from somewhere after working on paper/notebook,working on paper/notebook after taking a towel/s from somewhere,0.42735421657562256,0.41523027420043945,True
B4F0T,before,B4F0T_0.7_10.9.mp4,B4F0T_17.0_24.1.mp4,holding some medicine before someone is going from standing to sitting,someone is going from standing to sitting before holding some medicine,0.4651493430137634,0.43999892473220825,True
B4F0T,after,B4F0T_0.7_10.9.mp4,B4F0T_17.0_24.1.mp4,someone is going from standing to sitting after holding some medicine,holding some medicine after someone is going from standing to sitting,0.4647047519683838,0.4500521719455719,True
UTAGQ,before,UTAGQ_0.0_5.9.mp4,UTAGQ_6.4_11.5.mp4,someone is eating something before taking a book from somewhere,taking a book from somewhere before someone is eating something,0.42496246099472046,0.41177552938461304,True
UTAGQ,after,UTAGQ_0.0_5.9.mp4,UTAGQ_6.4_11.5.mp4,taking a book from somewhere after someone is eating something,someone is eating something after taking a book from somewhere,0.41909918189048767,0.41645509004592896,True
0USFX,before,0USFX_0.0_4.2.mp4,0USFX_13.0_17.5.mp4,opening a closet/cabinet before putting a bag somewhere,putting a bag somewhere before opening a closet/cabinet,0.5230777263641357,0.5685427188873291,False
0USFX,after,0USFX_0.0_4.2.mp4,0USFX_13.0_17.5.mp4,putting a bag somewhere after opening a closet/cabinet,opening a closet/cabinet after putting a bag somewhere,0.6313288807868958,0.5199437141418457,True
WZCPT,before,WZCPT_3.4_10.5.mp4,WZCPT_11.6_18.5.mp4,opening a refrigerator before taking food from somewhere,taking food from somewhere before opening a refrigerator,0.3572612404823303,0.37969934940338135,False
WZCPT,after,WZCPT_3.4_10.5.mp4,WZCPT_11.6_18.5.mp4,taking food from somewhere after opening a refrigerator,opening a refrigerator after taking food from somewhere,0.3843211531639099,0.3698508143424988,True
ZPAM8,before,ZPAM8_1.0_8.3.mp4,ZPAM8_8.8_13.9.mp4,walking through a doorway before putting something on a table,putting something on a table before walking through a doorway,0.3922358453273773,0.4254820644855499,False
ZPAM8,after,ZPAM8_1.0_8.3.mp4,ZPAM8_8.8_13.9.mp4,putting something on a table after walking through a doorway,walking through a doorway after putting something on a table,0.4602278470993042,0.37893879413604736,True
XS7RN,before,XS7RN_6.7_17.4.mp4,XS7RN_21.4_26.9.mp4,putting a box somewhere before throwing a book somewhere,throwing a book somewhere before putting a box somewhere,0.4037051200866699,0.33335286378860474,True
XS7RN,after,XS7RN_6.7_17.4.mp4,XS7RN_21.4_26.9.mp4,throwing a book somewhere after putting a box somewhere,putting a box somewhere after throwing a book somewhere,0.3710891604423523,0.41688865423202515,False
QOWXK,before,QOWXK_3.8_10.1.mp4,QOWXK_15.7_45.1.mp4,someone is going from standing to sitting before sitting on the floor,sitting on the floor before someone is going from standing to sitting,0.44132721424102783,0.5010560750961304,False
QOWXK,after,QOWXK_3.8_10.1.mp4,QOWXK_15.7_45.1.mp4,sitting on the floor after someone is going from standing to sitting,someone is going from standing to sitting after sitting on the floor,0.5223528146743774,0.4710935950279236,True
K0X80,before,K0X80_3.1_8.6.mp4,K0X80_18.5_24.5.mp4,opening a door before walking through a doorway,walking through a doorway before opening a door,0.38752520084381104,0.5329738855361938,False
K0X80,after,K0X80_3.1_8.6.mp4,K0X80_18.5_24.5.mp4,walking through a doorway after opening a door,opening a door after walking through a doorway,0.49498212337493896,0.4717664122581482,True
44Y6S,before,44Y6S_9.1_14.6.mp4,44Y6S_35.4_41.3.mp4,taking something from a box before putting a phone/camera somewhere,putting a phone/camera somewhere before taking something from a box,0.45802631974220276,0.5275816917419434,False
44Y6S,after,44Y6S_9.1_14.6.mp4,44Y6S_35.4_41.3.mp4,putting a phone/camera somewhere after taking something from a box,taking something from a box after putting a phone/camera somewhere,0.5066606402397156,0.5059860348701477,True
59X8N,before,59X8N_0.0_12.1.mp4,59X8N_17.0_24.7.mp4,holding a box before putting a broom somewhere,putting a broom somewhere before holding a box,0.4930855631828308,0.4710947871208191,True
59X8N,after,59X8N_0.0_12.1.mp4,59X8N_17.0_24.7.mp4,putting a broom somewhere after holding a box,holding a box after putting a broom somewhere,0.47405725717544556,0.46186399459838867,True
1LZ53,before,1LZ53_1.7_13.0.mp4,1LZ53_18.4_29.6.mp4,sitting in a bed before opening a window,opening a window before sitting in a bed,0.5186254978179932,0.3991517424583435,True
1LZ53,after,1LZ53_1.7_13.0.mp4,1LZ53_18.4_29.6.mp4,opening a window after sitting in a bed,sitting in a bed after opening a window,0.4160798192024231,0.46224862337112427,False
ZAN58,before,ZAN58_7.4_12.6.mp4,ZAN58_13.1_28.7.mp4,putting a box somewhere before someone is sneezing,someone is sneezing before putting a box somewhere,0.3811931908130646,0.4444853961467743,False
ZAN58,after,ZAN58_7.4_12.6.mp4,ZAN58_13.1_28.7.mp4,someone is sneezing after putting a box somewhere,putting a box somewhere after someone is sneezing,0.42909783124923706,0.4844064712524414,False
8F17S,before,8F17S_0.0_4.5.mp4,8F17S_10.0_15.8.mp4,drinking from a cup/glass/bottle before opening a closet/cabinet,opening a closet/cabinet before drinking from a cup/glass/bottle,0.39305806159973145,0.3501042127609253,True
8F17S,after,8F17S_0.0_4.5.mp4,8F17S_10.0_15.8.mp4,opening a closet/cabinet after drinking from a cup/glass/bottle,drinking from a cup/glass/bottle after opening a closet/cabinet,0.37681031227111816,0.42908746004104614,False
673VM,before,673VM_91.7_102.8.mp4,673VM_104.2_161.8.mp4,walking through a doorway before holding a phone/camera,holding a phone/camera before walking through a doorway,0.5158479809761047,0.5313533544540405,False
673VM,after,673VM_91.7_102.8.mp4,673VM_104.2_161.8.mp4,holding a phone/camera after walking through a doorway,walking through a doorway after holding a phone/camera,0.5233665704727173,0.5175133943557739,True
WREDC,before,WREDC_0.0_12.0.mp4,WREDC_14.9_22.9.mp4,taking a cup/glass/bottle from somewhere before putting a dish/es somewhere,putting a dish/es somewhere before taking a cup/glass/bottle from somewhere,0.37601202726364136,0.42420411109924316,False
WREDC,after,WREDC_0.0_12.0.mp4,WREDC_14.9_22.9.mp4,putting a dish/es somewhere after taking a cup/glass/bottle from somewhere,taking a cup/glass/bottle from somewhere after putting a dish/es somewhere,0.4905663728713989,0.4239788055419922,True
1P7GJ,before,1P7GJ_15.1_22.3.mp4,1P7GJ_28.5_34.5.mp4,opening a closet/cabinet before putting a broom somewhere,putting a broom somewhere before opening a closet/cabinet,0.49555888772010803,0.522233247756958,False
1P7GJ,after,1P7GJ_15.1_22.3.mp4,1P7GJ_28.5_34.5.mp4,putting a broom somewhere after opening a closet/cabinet,opening a closet/cabinet after putting a broom somewhere,0.512210488319397,0.47915881872177124,True
AXJUB,before,AXJUB_4.7_13.0.mp4,AXJUB_25.7_35.1.mp4,taking food from somewhere before putting a sandwich somewhere,putting a sandwich somewhere before taking food from somewhere,0.39762505888938904,0.42626285552978516,False
AXJUB,after,AXJUB_4.7_13.0.mp4,AXJUB_25.7_35.1.mp4,putting a sandwich somewhere after taking food from somewhere,taking food from somewhere after putting a sandwich somewhere,0.49671798944473267,0.4369763433933258,True
JCNHL,before,JCNHL_0.4_8.8.mp4,JCNHL_12.0_21.4.mp4,someone is smiling before throwing clothes somewhere,throwing clothes somewhere before someone is smiling,0.4078429341316223,0.4607117176055908,False
JCNHL,after,JCNHL_0.4_8.8.mp4,JCNHL_12.0_21.4.mp4,throwing clothes somewhere after someone is smiling,someone is smiling after throwing clothes somewhere,0.508682131767273,0.4300459027290344,True
Y5826,before,Y5826_0.0_4.2.mp4,Y5826_10.8_33.5.mp4,someone is cooking something before throwing food somewhere,throwing food somewhere before someone is cooking something,0.5375972986221313,0.5532392263412476,False
Y5826,after,Y5826_0.0_4.2.mp4,Y5826_10.8_33.5.mp4,throwing food somewhere after someone is cooking something,someone is cooking something after throwing food somewhere,0.5174320936203003,0.48796501755714417,True
JL5O0,before,JL5O0_1.1_7.7.mp4,JL5O0_8.2_14.7.mp4,walking through a doorway before eating a sandwich,eating a sandwich before walking through a doorway,0.4858781695365906,0.47040536999702454,True
JL5O0,after,JL5O0_1.1_7.7.mp4,JL5O0_8.2_14.7.mp4,eating a sandwich after walking through a doorway,walking through a doorway after eating a sandwich,0.4874890148639679,0.47825372219085693,True
F3RM9,before,F3RM9_0.0_4.0.mp4,F3RM9_4.2_9.3.mp4,sitting in a bed before smiling at a book,smiling at a book before sitting in a bed,0.4261223077774048,0.38928526639938354,True
F3RM9,after,F3RM9_0.0_4.0.mp4,F3RM9_4.2_9.3.mp4,smiling at a book after sitting in a bed,sitting in a bed after smiling at a book,0.3947504162788391,0.41530925035476685,False
TMA9G,before,TMA9G_1.3_13.5.mp4,TMA9G_19.5_25.3.mp4,holding some food before closing a door,closing a door before holding some food,0.4650231599807739,0.38067156076431274,True
TMA9G,after,TMA9G_1.3_13.5.mp4,TMA9G_19.5_25.3.mp4,closing a door after holding some food,holding some food after closing a door,0.42067235708236694,0.4252609610557556,False
Y3NN8,before,Y3NN8_0.0_22.5.mp4,Y3NN8_23.9_34.0.mp4,sitting in a bed before grasping onto a doorknob,grasping onto a doorknob before sitting in a bed,0.5020304918289185,0.42552635073661804,True
Y3NN8,after,Y3NN8_0.0_22.5.mp4,Y3NN8_23.9_34.0.mp4,grasping onto a doorknob after sitting in a bed,sitting in a bed after grasping onto a doorknob,0.41429969668388367,0.5001243352890015,False
AF5BS,before,AF5BS_0.0_17.7.mp4,AF5BS_23.4_28.6.mp4,holding a phone/camera before someone is standing up from somewhere,someone is standing up from somewhere before holding a phone/camera,0.5059857368469238,0.48863232135772705,True
AF5BS,after,AF5BS_0.0_17.7.mp4,AF5BS_23.4_28.6.mp4,someone is standing up from somewhere after holding a phone/camera,holding a phone/camera after someone is standing up from somewhere,0.5211766958236694,0.48034554719924927,True
WENGZ,before,WENGZ_0.2_7.8.mp4,WENGZ_13.7_18.8.mp4,opening a refrigerator before closing a refrigerator,closing a refrigerator before opening a refrigerator,0.3381294906139374,0.3521050810813904,False
WENGZ,after,WENGZ_0.2_7.8.mp4,WENGZ_13.7_18.8.mp4,closing a refrigerator after opening a refrigerator,opening a refrigerator after closing a refrigerator,0.32436487078666687,0.35165107250213623,False
450TW,before,450TW_1.4_8.7.mp4,450TW_10.0_16.3.mp4,opening a book before someone is eating something,someone is eating something before opening a book,0.3728758990764618,0.40449661016464233,False
450TW,after,450TW_1.4_8.7.mp4,450TW_10.0_16.3.mp4,someone is eating something after opening a book,opening a book after someone is eating something,0.4223341643810272,0.3682962954044342,True
B0XI9,before,B0XI9_0.0_4.7.mp4,B0XI9_5.1_22.1.mp4,walking through a doorway before someone is eating something,someone is eating something before walking through a doorway,0.47256067395210266,0.46628594398498535,True
B0XI9,after,B0XI9_0.0_4.7.mp4,B0XI9_5.1_22.1.mp4,someone is eating something after walking through a doorway,walking through a doorway after someone is eating something,0.4984697997570038,0.5210595726966858,False
