video_id,conjugate,event1_clip,event2_clip,caption,distractor_caption,sim_positive,sim_negative,correct
OK2TU,before,OK2TU_1.0_19.0.mp4,OK2TU_21.2_49.2.mp4,tidying some clothes before holding a dish,holding a dish before tidying some clothes,0.4144400358200073,0.36056238412857056,True
OK2TU,after,OK2TU_1.0_19.0.mp4,OK2TU_21.2_49.2.mp4,holding a dish after tidying some clothes,tidying some clothes after holding a dish,0.3585648536682129,0.37397992610931396,False
5V5EL,before,5V5EL_0.0_6.5.mp4,5V5EL_7.2_17.5.mp4,taking a picture of something before taking a bag from somewhere,taking a bag from somewhere before taking a picture of something,0.36275070905685425,0.3179911971092224,True
5V5EL,after,5V5EL_0.0_6.5.mp4,5V5EL_7.2_17.5.mp4,taking a bag from somewhere after taking a picture of something,taking a picture of something after taking a bag from somewhere,0.31875526905059814,0.34534358978271484,False
OL2QI,before,OL2QI_3.7_15.9.mp4,OL2QI_18.0_25.0.mp4,throwing something on the floor before putting a pillow somewhere,putting a pillow somewhere before throwing something on the floor,0.2683233618736267,0.2565135955810547,True
OL2QI,after,OL2QI_3.7_15.9.mp4,OL2QI_18.0_25.0.mp4,putting a pillow somewhere after throwing something on the floor,throwing something on the floor after putting a pillow somewhere,0.23973935842514038,0.2307882457971573,True
GIQEO,before,GIQEO_0.0_7.9.mp4,GIQEO_11.8_17.8.mp4,opening a door before putting a cup/glass/bottle somewhere,putting a cup/glass/bottle somewhere before opening a door,0.4234050512313843,0.29135340452194214,True
GIQEO,after,GIQEO_0.0_7.9.mp4,GIQEO_11.8_17.8.mp4,putting a cup/glass/bottle somewhere after opening a door,opening a door after putting a cup/glass/bottle somewhere,0.3446093797683716,0.43659526109695435,False
8D4ZT,before,8D4ZT_0.0_3.1.mp4,8D4ZT_4.9_11.6.mp4,opening a bag before putting some food somewhere,putting some food somewhere before opening a bag,0.22550195455551147,0.21814461052417755,True
8D4ZT,after,8D4ZT_0.0_3.1.mp4,8D4ZT_4.9_11.6.mp4,putting some food somewhere after opening a bag,opening a bag after putting some food somewhere,0.2213047295808792,0.18600285053253174,True
YT2C3,before,YT2C3_0.7_10.2.mp4,YT2C3_12.5_18.6.mp4,opening a door before putting something on a shelf,putting something on a shelf before opening a door,0.39309775829315186,0.25535985827445984,True
YT2C3,after,YT2C3_0.7_10.2.mp4,YT2C3_12.5_18.6.mp4,putting something on a shelf after opening a door,opening a door after putting something on a shelf,0.30030643939971924,0.3754842281341553,False
JBFPI,before,JBFPI_0.0_9.3.mp4,JBFPI_11.0_18.2.mp4,working/playing on a laptop before putting a cup/glass/bottle somewhere,putting a cup/glass/bottle somewhere before working/playing on a laptop,0.4151422679424286,0.2986457347869873,True
JBFPI,after,JBFPI_0.0_9.3.mp4,JBFPI_11.0_18.2.mp4,putting a cup/glass/bottle somewhere after working/playing on a laptop,working/playing on a laptop after putting a cup/glass/bottle somewhere,0.3108992576599121,0.402911901473999,False
KE5EM,before,KE5EM_1.4_6.8.mp4,KE5EM_6.8_11.0.mp4,someone is going from standing to sitting before throwing something on the floor,throwing something on the floor before someone is going from standing to sitting,0.33052313327789307,0.3118113577365875,True
KE5EM,after,KE5EM_1.4_6.8.mp4,KE5EM_6.8_11.0.mp4,throwing something on the floor after someone is going from standing to sitting,someone is going from standing to sitting after throwing something on the floor,0.3133067786693573,0.32972660660743713,False
GFFJM,before,GFFJM_0.0_19.9.mp4,GFFJM_23.3_31.2.mp4,putting on shoe/shoes before walking through a doorway,walking through a doorway before putting on shoe/shoes,0.3109760582447052,0.3391590714454651,False
GFFJM,after,GFFJM_0.0_19.9.mp4,GFFJM_23.3_31.2.mp4,walking through a doorway after putting on shoe/shoes,putting on shoe/shoes after walking through a doorway,0.3333446681499481,0.32697340846061707,True
EFI64,before,EFI64_0.0_5.7.mp4,EFI64_18.0_26.9.mp4,drinking from a cup/glass/bottle before watching a laptop or something on a laptop,watching a laptop or something on a laptop before drinking from a cup/glass/bottle,0.4350508451461792,0.42749258875846863,True
EFI64,after,EFI64_0.0_5.7.mp4,EFI64_18.0_26.9.mp4,watching a laptop or something on a laptop after drinking from a cup/glass/bottle,drinking from a cup/glass/bottle after watching a laptop or something on a laptop,0.4486203193664551,0.445335328578949,True
AWN1C,before,AWN1C_0.0_29.0.mp4,AWN1C_38.2_45.2.mp4,wash a dish/dishes before someone is going from standing to sitting,someone is going from standing to sitting before wash a dish/dishes,0.2670641839504242,0.3307836651802063,False
AWN1C,after,AWN1C_0.0_29.0.mp4,AWN1C_38.2_45.2.mp4,someone is going from standing to sitting after wash a dish/dishes,wash a dish/dishes after someone is going from standing to sitting,0.3175990879535675,0.28525564074516296,True
4ETXZ,before,4ETXZ_10.2_15.4.mp4,4ETXZ_16.2_26.5.mp4,turning on a light before holding a blanket,holding a blanket before turning on a light,0.44434237480163574,0.3707367777824402,True
4ETXZ,after,4ETXZ_10.2_15.4.mp4,4ETXZ_16.2_26.5.mp4,holding a blanket after turning on a light,turning on a light after holding a blanket,0.39316999912261963,0.4168012738227844,False
M0QER,before,M0QER_0.0_47.0.mp4,M0QER_50.8_55.4.mp4,holding a book before tidying something on the floor,tidying something on the floor before holding a book,0.3141009211540222,0.25561782717704773,True
M0QER,after,M0QER_0.0_47.0.mp4,M0QER_50.8_55.4.mp4,tidying something on the floor after holding a book,holding a book after tidying something on the floor,0.26635345816612244,0.2808845341205597,False
1EJKT,before,1EJKT_0.0_5.6.mp4,1EJKT_9.7_20.6.mp4,someone is dressing before someone is sneezing,someone is sneezing before someone is dressing,0.34814760088920593,0.3280472755432129,True
1EJKT,after,1EJKT_0.0_5.6.mp4,1EJKT_9.7_20.6.mp4,someone is sneezing after someone is dressing,someone is dressing after someone is sneezing,0.32521677017211914,0.324743390083313,True
1GQAJ,before,1GQAJ_0.2_6.3.mp4,1GQAJ_8.2_28.4.mp4,walking through a doorway before tidying something on the floor,tidying something on the floor before walking through a doorway,0.41702383756637573,0.3350197672843933,True
1GQAJ,after,1GQAJ_0.2_6.3.mp4,1GQAJ_8.2_28.4.mp4,tidying something on the floor after walking through a doorway,walking through a doorway after tidying something on the floor,0.38758593797683716,0.41222459077835083,False
509W9,before,509W9_0.0_2.6.mp4,509W9_11.8_25.4.mp4,someone is standing up from somewhere before snuggling with a pillow,snuggling with a pillow before someone is standing up from somewhere,0.31818097829818726,0.3916487395763397,False
509W9,after,509W9_0.0_2.6.mp4,509W9_11.8_25.4.mp4,snuggling with a pillow after someone is standing up from somewhere,someone is standing up from somewhere after snuggling with a pillow,0.3897033929824829,0.30983608961105347,True
F8HLI,before,F8HLI_0.0_2.8.mp4,F8HLI_13.0_17.8.mp4,opening a laptop before closing a laptop,closing a laptop before opening a laptop,0.34303975105285645,0.28978586196899414,True
F8HLI,after,F8HLI_0.0_2.8.mp4,F8HLI_13.0_17.8.mp4,closing a laptop after opening a laptop,opening a laptop after closing a laptop,0.3334107995033264,0.3094622492790222,True
4FX6G,before,4FX6G_4.8_15.1.mp4,4FX6G_16.4_27.2.mp4,grasping onto a doorknob before holding a dish,holding a dish before grasping onto a doorknob,0.29563331604003906,0.2873973250389099,True
4FX6G,after,4FX6G_4.8_15.1.mp4,4FX6G_16.4_27.2.mp4,holding a dish after grasping onto a doorknob,grasping onto a doorknob after holding a dish,0.26522505283355713,0.25438550114631653,True
WKP5N,before,WKP5N_0.0_7.9.mp4,WKP5N_10.2_21.7.mp4,sitting at a table before holding some medicine,holding some medicine before sitting at a table,0.2602543234825134,0.27275002002716064,False
WKP5N,after,WKP5N_0.0_7.9.mp4,WKP5N_10.2_21.7.mp4,holding some medicine after sitting at a table,sitting at a table after holding some medicine,0.24970799684524536,0.24433740973472595,True
WZP3R,before,WZP3R_1.8_8.8.mp4,WZP3R_18.3_24.5.mp4,someone is going from standing to sitting before taking shoes from somewhere,taking shoes from somewhere before someone is going from standing to sitting,0.4219692051410675,0.30450335144996643,True
WZP3R,after,WZP3R_1.8_8.8.mp4,WZP3R_18.3_24.5.mp4,taking shoes from somewhere after someone is going from standing to sitting,someone is going from standing to sitting after taking shoes from somewhere,0.3434990346431732,0.43114417791366577,False
3TUUI,before,3TUUI_3.7_14.3.mp4,3TUUI_16.9_22.3.mp4,someone is going from standing to sitting before putting something on a table,putting something on a table before someone is going from standing to sitting,0.22859163582324982,0.23813855648040771,False
3TUUI,after,3TUUI_3.7_14.3.mp4,3TUUI_16.9_22.3.mp4,putting something on a table after someone is going from standing to sitting,someone is going from standing to sitting after putting something on a table,0.22525113821029663,0.23195293545722961,False
2H9YB,before,2H9YB_2.0_22.8.mp4,2H9YB_26.9_31.6.mp4,fixing a light before opening a door,opening a door before fixing a light,0.48811882734298706,0.4672658443450928,True
2H9YB,after,2H9YB_2.0_22.8.mp4,2H9YB_26.9_31.6.mp4,opening a door after fixing a light,fixing a light after opening a door,0.49097752571105957,0.5011759400367737,False
YIK5I,before,YIK5I_0.0_12.5.mp4,YIK5I_12.7_22.1.mp4,watching television before tidying a shelf or something on a shelf,tidying a shelf or something on a shelf before watching television,0.39805734157562256,0.3835783004760742,True
YIK5I,after,YIK5I_0.0_12.5.mp4,YIK5I_12.7_22.1.mp4,tidying a shelf or something on a shelf after watching television,watching television after tidying a shelf or something on a shelf,0.42582419514656067,0.3886617422103882,True
Z1A0Q,before,Z1A0Q_0.0_6.1.mp4,Z1A0Q_15.0_22.8.mp4,someone is going from standing to sitting before someone is standing up from somewhere,someone is standing up from somewhere before someone is going from standing to sitting,0.3357391059398651,0.27807360887527466,True
Z1A0Q,after,Z1A0Q_0.0_6.1.mp4,Z1A0Q_15.0_22.8.mp4,someone is standing up from somewhere after someone is going from standing to sitting,someone is going from standing to sitting after someone is standing up from somewhere,0.29080110788345337,0.3297569751739502,False
JA3MN,before,JA3MN_0.6_6.2.mp4,JA3MN_6.2_16.5.mp4,opening a door before holding a towel/s,holding a towel/s before opening a door,0.41400817036628723,0.34149378538131714,True
JA3MN,after,JA3MN_0.6_6.2.mp4,JA3MN_6.2_16.5.mp4,holding a towel/s after opening a door,opening a door after holding a towel/s,0.3873748183250427,0.39089083671569824,False
P1EK9,before,P1EK9_0.0_4.9.mp4,P1EK9_5.8_11.2.mp4,opening a door before opening a box,opening a box before opening a door,0.4176468551158905,0.33802530169487,True
P1EK9,after,P1EK9_0.0_4.9.mp4,P1EK9_5.8_11.2.mp4,opening a box after opening a door,opening a door after opening a box,0.4270685911178589,0.45379579067230225,False
NY5LX,before,NY5LX_0.0_14.1.mp4,NY5LX_17.4_24.0.mp4,tidying a shelf or something on a shelf before taking a bag from somewhere,taking a bag from somewhere before tidying a shelf or something on a shelf,0.3441515862941742,0.3215424418449402,True
NY5LX,after,NY5LX_0.0_14.1.mp4,NY5LX_17.4_24.0.mp4,taking a bag from somewhere after tidying a shelf or something on a shelf,tidying a shelf or something on a shelf after taking a bag from somewhere,0.3433917164802551,0.32291483879089355,True
OD1A5,before,OD1A5_0.1_11.8.mp4,OD1A5_12.3_29.4.mp4,washing their hands before holding a phone/camera,holding a phone/camera before washing their hands,0.2936348617076874,0.3044542074203491,False
OD1A5,after,OD1A5_0.1_11.8.mp4,OD1A5_12.3_29.4.mp4,holding a phone/camera after washing their hands,washing their hands after holding a phone/camera,0.27696746587753296,0.27763521671295166,False
G5G8K,before,G5G8K_0.0_10.7.mp4,G5G8K_11.1_22.1.mp4,holding a pillow before someone is smiling,someone is smiling before holding a pillow,0.24551114439964294,0.25240033864974976,False
G5G8K,after,G5G8K_0.0_10.7.mp4,G5G8K_11.1_22.1.mp4,someone is smiling after holding a pillow,holding a pillow after someone is smiling,0.23695571720600128,0.2200048863887787,True
C10FA,before,C10FA_0.0_4.9.mp4,C10FA_5.7_19.8.mp4,opening a door before putting something on a shelf,putting something on a shelf before opening a door,0.32075148820877075,0.2455236315727234,True
C10FA,after,C10FA_0.0_4.9.mp4,C10FA_5.7_19.8.mp4,putting something on a shelf after opening a door,opening a door after putting something on a shelf,0.2774060070514679,0.2972211241722107,False
NDLY5,before,NDLY5_0.0_8.1.mp4,NDLY5_9.6_16.5.mp4,snuggling with a pillow before throwing a pillow somewhere,throwing a pillow somewhere before snuggling with a pillow,0.3396959900856018,0.24752062559127808,True
NDLY5,after,NDLY5_0.0_8.1.mp4,NDLY5_9.6_16.5.mp4,throwing a pillow somewhere after snuggling with a pillow,snuggling with a pillow after throwing a pillow somewhere,0.33952468633651733,0.3121612071990967,True
38TF8,before,38TF8_0.0_8.5.mp4,38TF8_16.5_24.7.mp4,putting a cup/glass/bottle somewhere before tidying some clothes,tidying some clothes before putting a cup/glass/bottle somewhere,0.10433795303106308,0.09715420007705688,True
38TF8,after,38TF8_0.0_8.5.mp4,38TF8_16.5_24.7.mp4,tidying some clothes after putting a cup/glass/bottle somewhere,putting a cup/glass/bottle somewhere after tidying some clothes,0.09595572203397751,0.10238002240657806,False
4VCHD,before,4VCHD_0.0_3.2.mp4,4VCHD_5.8_11.9.mp4,opening a door before someone is going from standing to sitting,someone is going from standing to sitting before opening a door,0.4195343255996704,0.406305730342865,True
4VCHD,after,4VCHD_0.0_3.2.mp4,4VCHD_5.8_11.9.mp4,someone is going from standing to sitting after opening a door,opening a door after someone is going from standing to sitting,0.44230222702026367,0.4473997950553894,False
X8DZV,before,X8DZV_1.4_8.7.mp4,X8DZV_10.1_19.6.mp4,turning on a light before sitting at a table,sitting at a table before turning on a light,0.5141553282737732,0.34382155537605286,True
X8DZV,after,X8DZV_1.4_8.7.mp4,X8DZV_10.1_19.6.mp4,sitting at a table after turning on a light,turning on a light after sitting at a table,0.4253075122833252,0.5091263651847839,False
O1LMX,before,O1LMX_1.9_14.3.mp4,O1LMX_15.0_23.0.mp4,holding a book before someone is going from standing to sitting,someone is going from standing to sitting before holding a book,0.3406743109226227,0.3433670997619629,False
O1LMX,after,O1LMX_1.9_14.3.mp4,O1LMX_15.0_23.0.mp4,someone is going from standing to sitting after holding a book,holding a book after someone is going from standing to sitting,0.34171468019485474,0.32798486948013306,True
WDCGH,before,WDCGH_0.0_2.9.mp4,WDCGH_3.4_11.2.mp4,opening a book before holding a book,holding a book before opening a book,0.23215648531913757,0.2498442381620407,False
WDCGH,after,WDCGH_0.0_2.9.mp4,WDCGH_3.4_11.2.mp4,holding a book after opening a book,opening a book after holding a book,0.2636668086051941,0.23163270950317383,True
3L3LC,before,3L3LC_0.0_6.8.mp4,3L3LC_11.8_22.7.mp4,opening a door before putting clothes somewhere,putting clothes somewhere before opening a door,0.3309907913208008,0.2501864433288574,True
3L3LC,after,3L3LC_0.0_6.8.mp4,3L3LC_11.8_22.7.mp4,putting clothes somewhere after opening a door,opening a door after putting clothes somewhere,0.3200865387916565,0.34247860312461853,False
0WYBK,before,0WYBK_0.0_4.7.mp4,0WYBK_7.5_12.1.mp4,opening a book before closing a book,closing a book before opening a book,0.235380619764328,0.21130099892616272,True
0WYBK,after,0WYBK_0.0_4.7.mp4,0WYBK_7.5_12.1.mp4,closing a book after opening a book,opening a book after closing a book,0.22923851013183594,0.2278899848461151,True
QZZPS,before,QZZPS_0.0_12.0.mp4,QZZPS_19.3_25.2.mp4,holding a phone/camera before taking/consuming some medicine,taking/consuming some medicine before holding a phone/camera,0.32176607847213745,0.32934021949768066,False
QZZPS,after,QZZPS_0.0_12.0.mp4,QZZPS_19.3_25.2.mp4,taking/consuming some medicine after holding a phone/camera,holding a phone/camera after taking/consuming some medicine,0.3465318977832794,0.3162478506565094,True
K5NFS,before,K5NFS_0.0_6.4.mp4,K5NFS_6.5_13.2.mp4,lying on the floor before someone is standing up from somewhere,someone is standing up from somewhere before lying on the floor,0.3998270034790039,0.4437522292137146,False
K5NFS,after,K5NFS_0.0_6.4.mp4,K5NFS_6.5_13.2.mp4,someone is standing up from somewhere after lying on the floor,lying on the floor after someone is standing up from somewhere,0.551226794719696,0.39629095792770386,True
D7LMI,before,D7LMI_1.5_6.7.mp4,D7LMI_7.2_22.7.mp4,taking shoes from somewhere before holding a box,holding a box before taking shoes from somewhere,0.37007299065589905,0.3856958746910095,False
D7LMI,after,D7LMI_1.5_6.7.mp4,D7LMI_7.2_22.7.mp4,holding a box after taking shoes from somewhere,taking shoes from somewhere after holding a box,0.39623022079467773,0.36228764057159424,True
H2ZYY,before,H2ZYY_0.0_6.9.mp4,H2ZYY_6.9_13.6.mp4,opening a closet/cabinet before closing a closet/cabinet,closing a closet/cabinet before opening a closet/cabinet,0.4534805417060852,0.359111487865448,True
H2ZYY,after,H2ZYY_0.0_6.9.mp4,H2ZYY_6.9_13.6.mp4,closing a closet/cabinet after opening a closet/cabinet,opening a closet/cabinet after closing a closet/cabinet,0.38654831051826477,0.4254918098449707,False
09W8V,before,09W8V_0.0_16.0.mp4,09W8V_20.1_26.0.mp4,watching/looking at a picture before walking through a doorway,walking through a doorway before watching/looking at a picture,0.2895547151565552,0.29375261068344116,False
09W8V,after,09W8V_0.0_16.0.mp4,09W8V_20.1_26.0.mp4,walking through a doorway after watching/looking at a picture,watching/looking at a picture after walking through a doorway,0.2908613085746765,0.2974361479282379,False
K64GM,before,K64GM_0.0_4.9.mp4,K64GM_11.0_15.8.mp4,taking a picture of something before putting a phone/camera somewhere,putting a phone/camera somewhere before taking a picture of something,0.3184511363506317,0.3292069435119629,False
K64GM,after,K64GM_0.0_4.9.mp4,K64GM_11.0_15.8.mp4,putting a phone/camera somewhere after taking a picture of something,taking a picture of something after putting a phone/camera somewhere,0.31385108828544617,0.3401091396808624,False
83V0A,before,83V0A_0.0_6.7.mp4,83V0A_8.6_14.4.mp4,someone is cooking something before taking a book from somewhere,taking a book from somewhere before someone is cooking something,0.2915254831314087,0.19678917527198792,True
83V0A,after,83V0A_0.0_6.7.mp4,83V0A_8.6_14.4.mp4,taking a book from somewhere after someone is cooking something,someone is cooking something after taking a book from somewhere,0.25038406252861023,0.27095144987106323,False
3MSZA,before,3MSZA_3.7_8.4.mp4,3MSZA_22.7_29.7.mp4,someone is smiling before turning off a light,turning off a light before someone is smiling,0.24235974252223969,0.215711772441864,True
3MSZA,after,3MSZA_3.7_8.4.mp4,3MSZA_22.7_29.7.mp4,turning off a light after someone is smiling,someone is smiling after turning off a light,0.2344903200864792,0.2274940013885498,True
IGF81,before,IGF81_0.0_15.8.mp4,IGF81_17.3_21.7.mp4,tidying up a towel/s before opening a closet/cabinet,opening a closet/cabinet before tidying up a towel/s,0.3357083797454834,0.32283908128738403,True
IGF81,after,IGF81_0.0_15.8.mp4,IGF81_17.3_21.7.mp4,opening a closet/cabinet after tidying up a towel/s,tidying up a towel/s after opening a closet/cabinet,0.3082394301891327,0.3492465019226074,False
R1RDT,before,R1RDT_0.0_9.8.mp4,R1RDT_10.1_19.3.mp4,snuggling with a blanket before someone is standing up from somewhere,someone is standing up from somewhere before snuggling with a blanket,0.3062995374202728,0.3308905363082886,False
R1RDT,after,R1RDT_0.0_9.8.mp4,R1RDT_10.1_19.3.mp4,someone is standing up from somewhere after snuggling with a blanket,snuggling with a blanket after someone is standing up from somewhere,0.38823598623275757,0.2681727111339569,True
BMLFA,before,BMLFA_0.0_16.4.mp4,BMLFA_18.8_25.4.mp4,holding a vacuum before closing a refrigerator,closing a refrigerator before holding a vacuum,0.4497331380844116,0.4027984142303467,True
BMLFA,after,BMLFA_0.0_16.4.mp4,BMLFA_18.8_25.4.mp4,closing a refrigerator after holding a vacuum,holding a vacuum after closing a refrigerator,0.4031240940093994,0.42914867401123047,False
30TL5,before,30TL5_0.2_8.7.mp4,30TL5_9.2_26.3.mp4,closing a book before someone is standing up from somewhere,someone is standing up from somewhere before closing a book,0.3616507649421692,0.328086256980896,True
30TL5,after,30TL5_0.2_8.7.mp4,30TL5_9.2_26.3.mp4,someone is standing up from somewhere after closing a book,closing a book after someone is standing up from somewhere,0.31205612421035767,0.34625327587127686,False
AIYFU,before,AIYFU_0.0_10.9.mp4,AIYFU_12.5_18.8.mp4,putting a dish/es somewhere before someone is standing up from somewhere,someone is standing up from somewhere before putting a dish/es somewhere,0.16640129685401917,0.17421239614486694,False
AIYFU,after,AIYFU_0.0_10.9.mp4,AIYFU_12.5_18.8.mp4,someone is standing up from somewhere after putting a dish/es somewhere,putting a dish/es somewhere after someone is standing up from somewhere,0.17592860758304596,0.1992231011390686,False
6AJX0,before,6AJX0_0.9_7.1.mp4,6AJX0_7.2_13.4.mp4,opening a closet/cabinet before closing a closet/cabinet,closing a closet/cabinet before opening a closet/cabinet,0.3227880597114563,0.22411447763442993,True
6AJX0,after,6AJX0_0.9_7.1.mp4,6AJX0_7.2_13.4.mp4,closing a closet/cabinet after opening a closet/cabinet,opening a closet/cabinet after closing a closet/cabinet,0.24475325644016266,0.32869037985801697,False
ISHJ4,before,ISHJ4_0.0_6.1.mp4,ISHJ4_10.4_16.8.mp4,grasping onto a doorknob before opening a door,opening a door before grasping onto a doorknob,0.3958110809326172,0.4172750413417816,False
ISHJ4,after,ISHJ4_0.0_6.1.mp4,ISHJ4_10.4_16.8.mp4,opening a door after grasping onto a doorknob,grasping onto a doorknob after opening a door,0.4604548215866089,0.388918399810791,True
I164P,before,I164P_7.6_12.9.mp4,I164P_14.0_21.5.mp4,taking a dish/es from somewhere before opening a door,opening a door before taking a dish/es from somewhere,0.41514095664024353,0.40279608964920044,True
I164P,after,I164P_7.6_12.9.mp4,I164P_14.0_21.5.mp4,opening a door after taking a dish/es from somewhere,taking a dish/es from somewhere after opening a door,0.41331255435943604,0.42231231927871704,False
AEZDA,before,AEZDA_0.0_9.5.mp4,AEZDA_9.9_18.1.mp4,someone is eating something before holding a vacuum,holding a vacuum before someone is eating something,0.3778409957885742,0.3113560080528259,True
AEZDA,after,AEZDA_0.0_9.5.mp4,AEZDA_9.9_18.1.mp4,holding a vacuum after someone is eating something,someone is eating something after holding a vacuum,0.30445414781570435,0.32812047004699707,False
DMI87,before,DMI87_0.0_11.5.mp4,DMI87_13.5_22.1.mp4,washing their hands before putting a towel/s somewhere,putting a towel/s somewhere before washing their hands,0.15878596901893616,0.21085387468338013,False
DMI87,after,DMI87_0.0_11.5.mp4,DMI87_13.5_22.1.mp4,putting a towel/s somewhere after washing their hands,washing their hands after putting a towel/s somewhere,0.1755455881357193,0.15465012192726135,True
250SN,before,250SN_0.0_3.6.mp4,250SN_4.0_10.5.mp4,holding a shoe/shoes before putting shoes somewhere,putting shoes somewhere before holding a shoe/shoes,0.10407675057649612,0.1204667016863823,False
250SN,after,250SN_0.0_3.6.mp4,250SN_4.0_10.5.mp4,putting shoes somewhere after holding a shoe/shoes,holding a shoe/shoes after putting shoes somewhere,0.12606260180473328,0.12093791365623474,True
5EFVR,before,5EFVR_3.4_8.4.mp4,5EFVR_8.6_13.4.mp4,taking some clothes from somewhere before putting clothes somewhere,putting clothes somewhere before taking some clothes from somewhere,0.3460811376571655,0.35621172189712524,False
5EFVR,after,5EFVR_3.4_8.4.mp4,5EFVR_8.6_13.4.mp4,putting clothes somewhere after taking some clothes from somewhere,taking some clothes from somewhere after putting clothes somewhere,0.3646981120109558,0.3372111916542053,True
4H64T,before,4H64T_2.3_13.2.mp4,4H64T_14.6_21.2.mp4,watching television before opening a refrigerator,opening a refrigerator before watching television,0.4867650270462036,0.4670288562774658,True
4H64T,after,4H64T_2.3_13.2.mp4,4H64T_14.6_21.2.mp4,opening a refrigerator after watching television,watching television after opening a refrigerator,0.49003174901008606,0.4669516086578369,True
KT3MJ,before,KT3MJ_0.0_3.8.mp4,KT3MJ_5.2_10.3.mp4,opening a refrigerator before closing a refrigerator,closing a refrigerator before opening a refrigerator,0.4431023597717285,0.2429489642381668,True
KT3MJ,after,KT3MJ_0.0_3.8.mp4,KT3MJ_5.2_10.3.mp4,closing a refrigerator after opening a refrigerator,opening a refrigerator after closing a refrigerator,0.28068387508392334,0.42726224660873413,False
1YAYG,before,1YAYG_0.4_6.1.mp4,1YAYG_12.7_17.5.mp4,walking through a doorway before putting a dish/es somewhere,putting a dish/es somewhere before walking through a doorway,0.36311930418014526,0.31930071115493774,True
1YAYG,after,1YAYG_0.4_6.1.mp4,1YAYG_12.7_17.5.mp4,putting a dish/es somewhere after walking through a doorway,walking through a doorway after putting a dish/es somewhere,0.3426196277141571,0.34241464734077454,True
9A90E,before,9A90E_1.1_8.4.mp4,9A90E_15.2_21.4.mp4,opening a refrigerator before putting a cup/glass/bottle somewhere,putting a cup/glass/bottle somewhere before opening a refrigerator,0.5289061069488525,0.2846047282218933,True
9A90E,after,9A90E_1.1_8.4.mp4,9A90E_15.2_21.4.mp4,putting a cup/glass/bottle somewhere after opening a refrigerator,opening a refrigerator after putting a cup/glass/bottle somewhere,0.36841022968292236,0.5371842384338379,False
