video_id,conjugate,event1_clip,event2_clip,caption,distractor_caption,sim_positive,sim_negative,correct
VLE11,after,VLE11_0.0_15.3.mp4,VLE11_19.7_24.9.mp4,putting a phone/camera somewhere after playing with a phone/camera,playing with a phone/camera after putting a phone/camera somewhere,0.3692184090614319,0.3990326225757599,False
PIJRH,before,PIJRH_0.0_5.5.mp4,PIJRH_6.9_12.7.mp4,walking through a doorway before taking a pillow from somewhere,taking a pillow from somewhere before walking through a doorway,0.31299054622650146,0.2871977686882019,True
PIJRH,after,PIJRH_0.0_5.5.mp4,PIJRH_6.9_12.7.mp4,taking a pillow from somewhere after walking through a doorway,walking through a doorway after taking a pillow from somewhere,0.3069669008255005,0.305613249540329,True
IET7H,before,IET7H_0.0_3.9.mp4,IET7H_7.5_17.2.mp4,walking through a doorway before opening a closet/cabinet,opening a closet/cabinet before walking through a doorway,0.3187905550003052,0.3285423219203949,False
IET7H,after,IET7H_0.0_3.9.mp4,IET7H_7.5_17.2.mp4,opening a closet/cabinet after walking through a doorway,walking through a doorway after opening a closet/cabinet,0.3203682601451874,0.3436349332332611,False
SAK7K,before,SAK7K_0.0_10.8.mp4,SAK7K_19.2_26.5.mp4,holding a vacuum before taking a cup/glass/bottle from somewhere,taking a cup/glass/bottle from somewhere before holding a vacuum,0.29786866903305054,0.22663962841033936,True
SAK7K,after,SAK7K_0.0_10.8.mp4,SAK7K_19.2_26.5.mp4,taking a cup/glass/bottle from somewhere after holding a vacuum,holding a vacuum after taking a cup/glass/bottle from somewhere,0.25773125886917114,0.2996407151222229,False
7HV9Q,before,7HV9Q_0.0_10.8.mp4,7HV9Q_15.3_22.0.mp4,opening a laptop before someone is smiling,someone is smiling before opening a laptop,0.19813290238380432,0.21062734723091125,False
7HV9Q,after,7HV9Q_0.0_10.8.mp4,7HV9Q_15.3_22.0.mp4,someone is smiling after opening a laptop,opening a laptop after someone is smiling,0.1919703185558319,0.19215714931488037,False
6912B,before,6912B_2.1_13.9.mp4,6912B_14.7_21.2.mp4,tidying up a blanket/s before opening a laptop,opening a laptop before tidying up a blanket/s,0.4090197682380676,0.3447331488132477,True
6912B,after,6912B_2.1_13.9.mp4,6912B_14.7_21.2.mp4,opening a laptop after tidying up a blanket/s,tidying up a blanket/s after opening a laptop,0.33105677366256714,0.37744247913360596,False
WK9HE,before,WK9HE_0.0_7.6.mp4,WK9HE_8.4_15.3.mp4,washing a cup/glass/bottle before tidying up with a broom,tidying up with a broom before washing a cup/glass/bottle,0.27037736773490906,0.28698888421058655,False
WK9HE,after,WK9HE_0.0_7.6.mp4,WK9HE_8.4_15.3.mp4,tidying up with a broom after washing a cup/glass/bottle,washing a cup/glass/bottle after tidying up with a broom,0.2638881206512451,0.26724159717559814,False
ZFQNZ,before,ZFQNZ_1.5_7.8.mp4,ZFQNZ_8.9_13.8.mp4,opening a refrigerator before closing a refrigerator,closing a refrigerator before opening a refrigerator,0.5025636553764343,0.3120001554489136,True
ZFQNZ,after,ZFQNZ_1.5_7.8.mp4,ZFQNZ_8.9_13.8.mp4,closing a refrigerator after opening a refrigerator,opening a refrigerator after closing a refrigerator,0.3470986485481262,0.452210009098053,False
T38JM,before,T38JM_1.5_14.3.mp4,T38JM_14.3_23.2.mp4,tidying up with a broom before someone is laughing,someone is laughing before tidying up with a broom,0.3163090944290161,0.2942846417427063,True
T38JM,after,T38JM_1.5_14.3.mp4,T38JM_14.3_23.2.mp4,someone is laughing after tidying up with a broom,tidying up with a broom after someone is laughing,0.28530576825141907,0.30141642689704895,False
1G2QC,before,1G2QC_0.0_17.1.mp4,1G2QC_22.8_28.5.mp4,someone is dressing before putting something on a table,putting something on a table before someone is dressing,0.45534175634384155,0.38279545307159424,True
1G2QC,after,1G2QC_0.0_17.1.mp4,1G2QC_22.8_28.5.mp4,putting something on a table after someone is dressing,someone is dressing after putting something on a table,0.40079888701438904,0.4856771230697632,False
WU8I6,before,WU8I6_2.1_7.7.mp4,WU8I6_15.6_22.2.mp4,holding some medicine before putting something on a table,putting something on a table before holding some medicine,0.26257437467575073,0.2756608724594116,False
WU8I6,after,WU8I6_2.1_7.7.mp4,WU8I6_15.6_22.2.mp4,putting something on a table after holding some medicine,holding some medicine after putting something on a table,0.2811776399612427,0.28065985441207886,True
AQ5M6,before,AQ5M6_0.0_7.7.mp4,AQ5M6_9.8_18.2.mp4,turning off a light before holding a towel/s,holding a towel/s before turning off a light,0.34710949659347534,0.3278745114803314,True
AQ5M6,after,AQ5M6_0.0_7.7.mp4,AQ5M6_9.8_18.2.mp4,holding a towel/s after turning off a light,turning off a light after holding a towel/s,0.3308028280735016,0.3330641984939575,False
I75CL,before,I75CL_0.0_6.9.mp4,I75CL_10.7_17.9.mp4,opening a door before someone is eating something,someone is eating something before opening a door,0.46619969606399536,0.4987872838973999,False
I75CL,after,I75CL_0.0_6.9.mp4,I75CL_10.7_17.9.mp4,someone is eating something after opening a door,opening a door after someone is eating something,0.525374174118042,0.5177924036979675,True
2M9YL,before,2M9YL_2.2_7.4.mp4,2M9YL_9.0_18.9.mp4,taking a dish/es from somewhere before holding a sandwich,holding a sandwich before taking a dish/es from somewhere,0.3176448941230774,0.27243635058403015,True
2M9YL,after,2M9YL_2.2_7.4.mp4,2M9YL_9.0_18.9.mp4,holding a sandwich after taking a dish/es from somewhere,taking a dish/es from somewhere after holding a sandwich,0.26182737946510315,0.31616634130477905,False
NQKZB,before,NQKZB_0.0_12.5.mp4,NQKZB_13.2_31.9.mp4,tidying some clothes before holding a pillow,holding a pillow before tidying some clothes,0.4489043653011322,0.4436417818069458,True
NQKZB,after,NQKZB_0.0_12.5.mp4,NQKZB_13.2_31.9.mp4,holding a pillow after tidying some clothes,tidying some clothes after holding a pillow,0.40158408880233765,0.4234236478805542,False
CWUDQ,before,CWUDQ_0.6_10.1.mp4,CWUDQ_12.0_19.4.mp4,walking through a doorway before someone is undressing,someone is undressing before walking through a doorway,0.4384276866912842,0.42889708280563354,True
CWUDQ,after,CWUDQ_0.6_10.1.mp4,CWUDQ_12.0_19.4.mp4,someone is undressing after walking through a doorway,walking through a doorway after someone is undressing,0.4612095355987549,0.43819141387939453,True
L8HMR,before,L8HMR_0.0_14.0.mp4,L8HMR_18.1_23.6.mp4,holding a blanket before putting something on a shelf,putting something on a shelf before holding a blanket,0.31791529059410095,0.39206719398498535,False
L8HMR,after,L8HMR_0.0_14.0.mp4,L8HMR_18.1_23.6.mp4,putting something on a shelf after holding a blanket,holding a blanket after putting something on a shelf,0.38344675302505493,0.3187658488750458,True
H1J19,before,H1J19_0.0_17.1.mp4,H1J19_17.8_23.2.mp4,eating a sandwich before putting something on a table,putting something on a table before eating a sandwich,0.235010027885437,0.19987154006958008,True
H1J19,after,H1J19_0.0_17.1.mp4,H1J19_17.8_23.2.mp4,putting something on a table after eating a sandwich,eating a sandwich after putting something on a table,0.201837420463562,0.23158475756645203,False
1AA6Z,before,1AA6Z_0.0_7.7.mp4,1AA6Z_8.2_16.3.mp4,someone is undressing before taking food from somewhere,taking food from somewhere before someone is undressing,0.3167555332183838,0.20991691946983337,True
1AA6Z,after,1AA6Z_0.0_7.7.mp4,1AA6Z_8.2_16.3.mp4,taking food from somewhere after someone is undressing,someone is undressing after taking food from somewhere,0.25746238231658936,0.2980138063430786,False
GL7ER,before,GL7ER_0.0_2.9.mp4,GL7ER_5.0_16.6.mp4,putting a dish/es somewhere before taking a dish/es from somewhere,taking a dish/es from somewhere before putting a dish/es somewhere,0.30294501781463623,0.26597222685813904,True
GL7ER,after,GL7ER_0.0_2.9.mp4,GL7ER_5.0_16.6.mp4,taking a dish/es from somewhere after putting a dish/es somewhere,putting a dish/es somewhere after taking a dish/es from somewhere,0.2573722302913666,0.2661740183830261,False
5VDT6,before,5VDT6_2.0_9.3.mp4,5VDT6_18.3_23.1.mp4,drinking from a cup/glass/bottle before throwing something on the floor,throwing something on the floor before drinking from a cup/glass/bottle,0.3529016077518463,0.34992098808288574,True
5VDT6,after,5VDT6_2.0_9.3.mp4,5VDT6_18.3_23.1.mp4,throwing something on the floor after drinking from a cup/glass/bottle,drinking from a cup/glass/bottle after throwing something on the floor,0.3304339647293091,0.33851826190948486,False
A2XH1,before,A2XH1_0.0_6.9.mp4,A2XH1_12.1_19.8.mp4,taking food from somewhere before someone is going from standing to sitting,someone is going from standing to sitting before taking food from somewhere,0.30008941888809204,0.3457791805267334,False
A2XH1,after,A2XH1_0.0_6.9.mp4,A2XH1_12.1_19.8.mp4,someone is going from standing to sitting after taking food from somewhere,taking food from somewhere after someone is going from standing to sitting,0.38758206367492676,0.320540189743042,True
VI2TX,before,VI2TX_1.3_5.6.mp4,VI2TX_6.9_12.3.mp4,putting something on a table before holding some food,holding some food before putting something on a table,0.20341987907886505,0.18166840076446533,True
VI2TX,after,VI2TX_1.3_5.6.mp4,VI2TX_6.9_12.3.mp4,holding some food after putting something on a table,putting something on a table after holding some food,0.18372240662574768,0.16205236315727234,True
Z2A7Q,before,Z2A7Q_0.0_9.1.mp4,Z2A7Q_17.2_22.1.mp4,someone is running somewhere before putting a box somewhere,putting a box somewhere before someone is running somewhere,0.24642311036586761,0.20064200460910797,True
Z2A7Q,after,Z2A7Q_0.0_9.1.mp4,Z2A7Q_17.2_22.1.mp4,putting a box somewhere after someone is running somewhere,someone is running somewhere after putting a box somewhere,0.20263445377349854,0.2451900839805603,False
OMBR9,before,OMBR9_4.5_13.1.mp4,OMBR9_20.5_64.9.mp4,someone is going from standing to sitting before putting something on a table,putting something on a table before someone is going from standing to sitting,0.36737918853759766,0.34984269738197327,True
OMBR9,after,OMBR9_4.5_13.1.mp4,OMBR9_20.5_64.9.mp4,putting something on a table after someone is going from standing to sitting,someone is going from standing to sitting after putting something on a table,0.35252711176872253,0.346140593290329,True
TX020,before,TX020_0.0_7.0.mp4,TX020_8.0_13.4.mp4,someone is running somewhere before someone is going from standing to sitting,someone is going from standing to sitting before someone is running somewhere,0.20841553807258606,0.22684162855148315,False
TX020,after,TX020_0.0_7.0.mp4,TX020_8.0_13.4.mp4,someone is going from standing to sitting after someone is running somewhere,someone is running somewhere after someone is going from standing to sitting,0.2388988435268402,0.20524896681308746,True
BKEYX,before,BKEYX_4.5_13.6.mp4,BKEYX_23.3_32.1.mp4,putting something on a shelf before drinking from a cup/glass/bottle,drinking from a cup/glass/bottle before putting something on a shelf,0.30628907680511475,0.3078169822692871,False
BKEYX,after,BKEYX_4.5_13.6.mp4,BKEYX_23.3_32.1.mp4,drinking from a cup/glass/bottle after putting something on a shelf,putting something on a shelf after drinking from a cup/glass/bottle,0.2973674237728119,0.2988353967666626,False
JOMFO,before,JOMFO_0.0_6.7.mp4,JOMFO_11.4_19.7.mp4,someone is going from standing to sitting before tidying up a blanket/s,tidying up a blanket/s before someone is going from standing to sitting,0.3605419397354126,0.3548765778541565,True
JOMFO,after,JOMFO_0.0_6.7.mp4,JOMFO_11.4_19.7.mp4,tidying up a blanket/s after someone is going from standing to sitting,someone is going from standing to sitting after tidying up a blanket/s,0.3650572597980499,0.34208035469055176,True
2544C,before,2544C_0.0_6.0.mp4,2544C_10.6_15.8.mp4,throwing a towel/s somewhere before putting a towel/s somewhere,putting a towel/s somewhere before throwing a towel/s somewhere,0.37599459290504456,0.3233652114868164,True
2544C,after,2544C_0.0_6.0.mp4,2544C_10.6_15.8.mp4,putting a towel/s somewhere after throwing a towel/s somewhere,throwing a towel/s somewhere after putting a towel/s somewhere,0.34439539909362793,0.3759215474128723,False
NNG97,before,NNG97_0.0_2.6.mp4,NNG97_8.0_28.5.mp4,throwing a book somewhere before holding a book,holding a book before throwing a book somewhere,0.2686428427696228,0.283237487077713,False
NNG97,after,NNG97_0.0_2.6.mp4,NNG97_8.0_28.5.mp4,holding a book after throwing a book somewhere,throwing a book somewhere after holding a book,0.2842370271682739,0.2921103239059448,False
XO97L,before,XO97L_0.2_9.5.mp4,XO97L_15.6_20.7.mp4,taking some clothes from somewhere before watching/looking outside of a window,watching/looking outside of a window before taking some clothes from somewhere,0.37278857827186584,0.31267285346984863,True
XO97L,after,XO97L_0.2_9.5.mp4,XO97L_15.6_20.7.mp4,watching/looking outside of a window after taking some clothes from somewhere,taking some clothes from somewhere after watching/looking outside of a window,0.2995363473892212,0.3655169606208801,False
BP94L,before,BP94L_0.0_12.3.mp4,BP94L_13.0_20.2.mp4,tidying up with a broom before holding a phone/camera,holding a phone/camera before tidying up with a broom,0.37455886602401733,0.36868953704833984,True
BP94L,after,BP94L_0.0_12.3.mp4,BP94L_13.0_20.2.mp4,holding a phone/camera after tidying up with a broom,tidying up with a broom after holding a phone/camera,0.3782130479812622,0.3504495620727539,True
Y0CA0,before,Y0CA0_6.5_12.4.mp4,Y0CA0_15.6_22.3.mp4,closing a closet/cabinet before someone is cooking something,someone is cooking something before closing a closet/cabinet,0.3368690013885498,0.43943363428115845,False
Y0CA0,after,Y0CA0_6.5_12.4.mp4,Y0CA0_15.6_22.3.mp4,someone is cooking something after closing a closet/cabinet,closing a closet/cabinet after someone is cooking something,0.43288367986679077,0.3756294250488281,True
JC9SA,before,JC9SA_0.0_7.0.mp4,JC9SA_8.9_16.5.mp4,closing a refrigerator before closing a door,closing a door before closing a refrigerator,0.21735456585884094,0.22332297265529633,False
JC9SA,after,JC9SA_0.0_7.0.mp4,JC9SA_8.9_16.5.mp4,closing a door after closing a refrigerator,closing a refrigerator after closing a door,0.22124610841274261,0.22631146013736725,False
NAZ52,before,NAZ52_0.0_6.1.mp4,NAZ52_11.0_15.9.mp4,opening a box before laughing at a picture,laughing at a picture before opening a box,0.5287134051322937,0.4751386344432831,True
NAZ52,after,NAZ52_0.0_6.1.mp4,NAZ52_11.0_15.9.mp4,laughing at a picture after opening a box,opening a box after laughing at a picture,0.5167663097381592,0.536036491394043,False
SDXZ8,before,SDXZ8_1.1_28.0.mp4,SDXZ8_33.5_38.8.mp4,taking a dish/es from somewhere before taking a vacuum from somewhere,taking a vacuum from somewhere before taking a dish/es from somewhere,0.374500572681427,0.36005041003227234,True
SDXZ8,after,SDXZ8_1.1_28.0.mp4,SDXZ8_33.5_38.8.mp4,taking a vacuum from somewhere after taking a dish/es from somewhere,taking a dish/es from somewhere after taking a vacuum from somewhere,0.37330350279808044,0.38087034225463867,False
61WIS,before,61WIS_0.0_5.6.mp4,61WIS_9.6_16.1.mp4,sitting on sofa/couch before putting a pillow somewhere,putting a pillow somewhere before sitting on sofa/couch,0.37612658739089966,0.34041720628738403,True
61WIS,after,61WIS_0.0_5.6.mp4,61WIS_9.6_16.1.mp4,putting a pillow somewhere after sitting on sofa/couch,sitting on sofa/couch after putting a pillow somewhere,0.34018367528915405,0.39351171255111694,False
73NG4,before,73NG4_0.0_5.8.mp4,73NG4_6.0_12.4.mp4,opening a refrigerator before putting some food somewhere,putting some food somewhere before opening a refrigerator,0.36727890372276306,0.2516799569129944,True
73NG4,after,73NG4_0.0_5.8.mp4,73NG4_6.0_12.4.mp4,putting some food somewhere after opening a refrigerator,opening a refrigerator after putting some food somewhere,0.3149968981742859,0.35487687587738037,False
65ULK,before,65ULK_0.0_3.5.mp4,65ULK_7.5_23.7.mp4,walking through a doorway before holding some clothes,holding some clothes before walking through a doorway,0.3922141194343567,0.3725234866142273,True
65ULK,after,65ULK_0.0_3.5.mp4,65ULK_7.5_23.7.mp4,holding some clothes after walking through a doorway,walking through a doorway after holding some clothes,0.3751303255558014,0.3724012076854706,True
N9VOV,before,N9VOV_4.1_9.8.mp4,N9VOV_19.0_24.3.mp4,taking a cup/glass/bottle from somewhere before putting something on a table,putting something on a table before taking a cup/glass/bottle from somewhere,0.208822101354599,0.2831276059150696,False
N9VOV,after,N9VOV_4.1_9.8.mp4,N9VOV_19.0_24.3.mp4,putting something on a table after taking a cup/glass/bottle from somewhere,taking a cup/glass/bottle from somewhere after putting something on a table,0.27993714809417725,0.20000268518924713,True
2GGH3,before,2GGH3_0.0_9.0.mp4,2GGH3_9.3_21.7.mp4,holding a box before holding some medicine,holding some medicine before holding a box,0.3441190719604492,0.27741485834121704,True
2GGH3,after,2GGH3_0.0_9.0.mp4,2GGH3_9.3_21.7.mp4,holding some medicine after holding a box,holding a box after holding some medicine,0.32131773233413696,0.3555564284324646,False
WB17C,before,WB17C_0.9_7.2.mp4,WB17C_7.5_15.1.mp4,opening a refrigerator before holding a bag,holding a bag before opening a refrigerator,0.5305049419403076,0.3784015476703644,True
WB17C,after,WB17C_0.9_7.2.mp4,WB17C_7.5_15.1.mp4,holding a bag after opening a refrigerator,opening a refrigerator after holding a bag,0.4174867868423462,0.46590155363082886,False
S7OTQ,before,S7OTQ_0.0_5.5.mp4,S7OTQ_13.3_20.7.mp4,someone is going from standing to sitting before closing a book,closing a book before someone is going from standing to sitting,0.39780598878860474,0.3351188004016876,True
S7OTQ,after,S7OTQ_0.0_5.5.mp4,S7OTQ_13.3_20.7.mp4,closing a book after someone is going from standing to sitting,someone is going from standing to sitting after closing a book,0.38934701681137085,0.37010079622268677,True
OU3XH,before,OU3XH_0.0_18.7.mp4,OU3XH_19.2_24.4.mp4,playing with a phone/camera before putting some food somewhere,putting some food somewhere before playing with a phone/camera,0.4384112060070038,0.387444406747818,True
OU3XH,after,OU3XH_0.0_18.7.mp4,OU3XH_19.2_24.4.mp4,putting some food somewhere after playing with a phone/camera,playing with a phone/camera after putting some food somewhere,0.4461163878440857,0.42397722601890564,True
0CX32,before,0CX32_0.0_4.5.mp4,0CX32_5.1_11.0.mp4,someone is running somewhere before holding a broom,holding a broom before someone is running somewhere,0.27309712767601013,0.2822834253311157,False
0CX32,after,0CX32_0.0_4.5.mp4,0CX32_5.1_11.0.mp4,holding a broom after someone is running somewhere,someone is running somewhere after holding a broom,0.27352994680404663,0.2888796627521515,False
UZRQD,before,UZRQD_0.8_23.2.mp4,UZRQD_23.3_28.6.mp4,playing with a phone/camera before someone is standing up from somewhere,someone is standing up from somewhere before playing with a phone/camera,0.39228641986846924,0.36242741346359253,True
UZRQD,after,UZRQD_0.8_23.2.mp4,UZRQD_23.3_28.6.mp4,someone is standing up from somewhere after playing with a phone/camera,playing with a phone/camera after someone is standing up from somewhere,0.3907499611377716,0.39296796917915344,False
Z6U1X,before,Z6U1X_0.0_11.4.mp4,Z6U1X_12.2_20.8.mp4,holding a broom before opening a door,opening a door before holding a broom,0.37087079882621765,0.3875586986541748,False
Z6U1X,after,Z6U1X_0.0_11.4.mp4,Z6U1X_12.2_20.8.mp4,opening a door after holding a broom,holding a broom after opening a door,0.39223790168762207,0.3522607088088989,True
GFK4S,before,GFK4S_0.0_12.6.mp4,GFK4S_14.1_20.6.mp4,lying on a sofa/couch before opening a door,opening a door before lying on a sofa/couch,0.29380351305007935,0.24608644843101501,True
GFK4S,after,GFK4S_0.0_12.6.mp4,GFK4S_14.1_20.6.mp4,opening a door after lying on a sofa/couch,lying on a sofa/couch after opening a door,0.3580687642097473,0.29277265071868896,True
Z5AZW,before,Z5AZW_0.0_3.8.mp4,Z5AZW_5.9_10.8.mp4,walking through a doorway before throwing a towel/s somewhere,throwing a towel/s somewhere before walking through a doorway,0.3741914629936218,0.3794078826904297,False
Z5AZW,after,Z5AZW_0.0_3.8.mp4,Z5AZW_5.9_10.8.mp4,throwing a towel/s somewhere after walking through a doorway,walking through a doorway after throwing a towel/s somewhere,0.4164240062236786,0.37391096353530884,True
CD11G,before,CD11G_0.0_7.7.mp4,CD11G_9.8_16.2.mp4,someone is cooking something before someone is eating something,someone is eating something before someone is cooking something,0.37764909863471985,0.2737501263618469,True
CD11G,after,CD11G_0.0_7.7.mp4,CD11G_9.8_16.2.mp4,someone is eating something after someone is cooking something,someone is cooking something after someone is eating something,0.29978418350219727,0.3337203860282898,False
2TAT3,before,2TAT3_0.3_6.4.mp4,2TAT3_7.7_16.3.mp4,walking through a doorway before drinking from a cup/glass/bottle,drinking from a cup/glass/bottle before walking through a doorway,0.4606754779815674,0.4566735625267029,True
2TAT3,after,2TAT3_0.3_6.4.mp4,2TAT3_7.7_16.3.mp4,drinking from a cup/glass/bottle after walking through a doorway,walking through a doorway after drinking from a cup/glass/bottle,0.4827020764350891,0.46686550974845886,True
UM5II,before,UM5II_0.9_7.7.mp4,UM5II_10.8_17.7.mp4,someone is sneezing before putting some food somewhere,putting some food somewhere before someone is sneezing,0.28654903173446655,0.25957363843917847,True
UM5II,after,UM5II_0.9_7.7.mp4,UM5II_10.8_17.7.mp4,putting some food somewhere after someone is sneezing,someone is sneezing after putting some food somewhere,0.2717699408531189,0.26512882113456726,True
9Q1N7,before,9Q1N7_0.0_11.7.mp4,9Q1N7_12.6_18.9.mp4,sitting on the floor before walking through a doorway,walking through a doorway before sitting on the floor,0.2719076871871948,0.2602301836013794,True
9Q1N7,after,9Q1N7_0.0_11.7.mp4,9Q1N7_12.6_18.9.mp4,walking through a doorway after sitting on the floor,sitting on the floor after walking through a doorway,0.2921977639198303,0.29924243688583374,False
Q5ZIL,before,Q5ZIL_0.0_6.7.mp4,Q5ZIL_8.7_24.6.mp4,someone is sneezing before holding some medicine,holding some medicine before someone is sneezing,0.19263316690921783,0.15986387431621552,True
Q5ZIL,after,Q5ZIL_0.0_6.7.mp4,Q5ZIL_8.7_24.6.mp4,holding some medicine after someone is sneezing,someone is sneezing after holding some medicine,0.18046757578849792,0.19225531816482544,False
EOUCM,before,EOUCM_0.0_8.9.mp4,EOUCM_13.4_19.9.mp4,putting a box somewhere before opening a box,opening a box before putting a box somewhere,0.43386292457580566,0.4145144820213318,True
EOUCM,after,EOUCM_0.0_8.9.mp4,EOUCM_13.4_19.9.mp4,opening a box after putting a box somewhere,putting a box somewhere after opening a box,0.3864680230617523,0.43523022532463074,False
QDPR8,before,QDPR8_0.0_10.4.mp4,QDPR8_20.2_25.2.mp4,taking food from somewhere before throwing food somewhere,throwing food somewhere before taking food from somewhere,0.22570577263832092,0.19127309322357178,True
QDPR8,after,QDPR8_0.0_10.4.mp4,QDPR8_20.2_25.2.mp4,throwing food somewhere after taking food from somewhere,taking food from somewhere after throwing food somewhere,0.22699932754039764,0.2493695467710495,False
0J1AQ,before,0J1AQ_0.9_6.5.mp4,0J1AQ_8.9_14.0.mp4,someone is going from standing to sitting before putting shoes somewhere,putting shoes somewhere before someone is going from standing to sitting,0.22070981562137604,0.2164611518383026,True
0J1AQ,after,0J1AQ_0.9_6.5.mp4,0J1AQ_8.9_14.0.mp4,putting shoes somewhere after someone is going from standing to sitting,someone is going from standing to sitting after putting shoes somewhere,0.24128195643424988,0.22631458938121796,True
3B97C,before,3B97C_2.1_8.5.mp4,3B97C_10.6_17.8.mp4,holding a laptop before putting something on a shelf,putting something on a shelf before holding a laptop,0.39682820439338684,0.38545531034469604,True
3B97C,after,3B97C_2.1_8.5.mp4,3B97C_10.6_17.8.mp4,putting something on a shelf after holding a laptop,holding a laptop after putting something on a shelf,0.36252373456954956,0.3733838200569153,False
3X52E,before,3X52E_0.0_3.8.mp4,3X52E_14.6_19.8.mp4,holding a blanket before throwing a blanket somewhere,throwing a blanket somewhere before holding a blanket,0.2716207504272461,0.30268505215644836,False
3X52E,after,3X52E_0.0_3.8.mp4,3X52E_14.6_19.8.mp4,throwing a blanket somewhere after holding a blanket,holding a blanket after throwing a blanket somewhere,0.2943868637084961,0.2703021764755249,True
QT6X8,before,QT6X8_4.6_15.2.mp4,QT6X8_26.2_36.1.mp4,throwing clothes somewhere before holding a picture,holding a picture before throwing clothes somewhere,0.2548193335533142,0.2379206418991089,True
QT6X8,after,QT6X8_4.6_15.2.mp4,QT6X8_26.2_36.1.mp4,holding a picture after throwing clothes somewhere,throwing clothes somewhere after holding a picture,0.17824392020702362,0.2064443677663803,False
DA7E9,before,DA7E9_0.0_13.7.mp4,DA7E9_21.8_28.4.mp4,holding some food before putting a book somewhere,putting a book somewhere before holding some food,0.25050050020217896,0.20552022755146027,True
DA7E9,after,DA7E9_0.0_13.7.mp4,DA7E9_21.8_28.4.mp4,putting a book somewhere after holding some food,holding some food after putting a book somewhere,0.21714277565479279,0.24519437551498413,False
SVEWD,before,SVEWD_0.0_6.0.mp4,SVEWD_14.2_21.3.mp4,working on paper/notebook before someone is standing up from somewhere,someone is standing up from somewhere before working on paper/notebook,0.3828667402267456,0.42788952589035034,False
SVEWD,after,SVEWD_0.0_6.0.mp4,SVEWD_14.2_21.3.mp4,someone is standing up from somewhere after working on paper/notebook,working on paper/notebook after someone is standing up from somewhere,0.4387912154197693,0.421985924243927,True
